0037,นำส่งแนวนโยบาย เรื่อง แนวทางการพิจารณาผ่อนผันการกำ กับลูกหนี้้ีรายใหญ่แก่ กลุ่มธุรกิจที่มีศักยภาพและมีฐานะกิจการที่มั่นคงสำหรับธนาคารพาณิชย์,นำส่งแนวนโยบาย เรื่อง แนวทางการพิจารณาผ่อนผันการกำกับลูกหนี้รายใหญ่แก่กลุ่มธุรกิจที่มีศักยภาพและมีฐานะกิจการที่มั่นคงสำหรับธนาคารพาณิชย์,25620153.pdf,2,['สถาบันการเงิน'],['หนังสือเวียน'],['2019-07-15 00:00:00'],['ใช้อยู่'],"['ธนาคารพาณิชย์จดทะเบียนในประเทศ', 'ธนาคารพาณิชย์ที่จดทะเบียนในต่างประเทศ']","['พรบ.สง. มาตรา  57', 'พรบ.สง. มาตรา  50']"
0039,ซักซ้อมความเข้าใจแนวทางบริหารเงินสำรองส่วนเกิน,ซักซ้อมความเข้าใจแนวทางการบริหารจัดการเงินสำรองส่วนเกิน,25620264.pdf,2,['สถาบันการเงิน'],['หนังสือเวียน'],['1900-01-01 00:00:00'],['ใช้อยู่'],"['ธนาคารพาณิชย์จดทะเบียนในประเทศ', 'บริษัทเงินทุน', 'บริษัทเครดิตฟองซิเอร์', 'ธนาคารพาณิชย์ที่จดทะเบียนในต่างประเทศ']",[]
0041,หลักเกณฑ์การดำรงเงินขั้นต่ำของสถาบนัการเงินและกลุ่มธุรกิจทางการเงิน,หนังสือเวียนนำส่งประกาศธนาคารแห่งประเทศไทย เรื่อง การดำรงเงินสำรองขั้นต่ำของสถาบันการเงินและกลุ่มธุรกิจทางการเงิน,25620307.pdf,2,['สถาบันการเงิน'],"['ประกาศ ธปท.', 'หนังสือเวียน']","['1900-01-01 00:00:00', '2020-01-01 00:00:00']",['ใช้อยู่'],"['ธนาคารพาณิชย์จดทะเบียนในประเทศ', 'บริษัทเงินทุน', 'บริษัทเครดิตฟองซิเอร์', 'ธนาคารพาณิชย์ที่จดทะเบียนในต่างประเทศ']","['พรบ.สง. มาตรา  57', 'พรบ.สง. มาตรา  30', 'พรบ.สง. มาตรา  32', 'พรบ.สง. มาตรา  29']"
0042,หลักเกณฑ์์การกำกับดูแลสินเชื่อเพื่อที่อยู่อาศัยและสินเชื่ออื่นที่เกี่ยวเนื่องกับ สินเชื่อเพื่อที่อยู่อาศัย,นำส่งประกาศธนาคารแห่งประเทศไทย เรื่อง หลักเกณฑ์การกำกับดูแลสินเชื่อเพื่อที่อยู่อาศัยและสินเชื่ออื่นที่เกี่ยวเนื่องกับสินเชื่อเพื่อที่อยู่อาศัย,25630013.pdf,2,['สถาบันการเงิน'],"['ประกาศ ธปท.', 'หนังสือเวียน']",['2020-01-20 00:00:00'],['ใช้อยู่'],"['ธนาคารพาณิชย์จดทะเบียนในประเทศ', 'บริษัทเงินทุน', 'บริษัทเครดิตฟองซิเอร์', 'ธนาคารพาณิชย์ที่จดทะเบียนในต่างประเทศ']","['พรบ.สง. มาตรา  30', 'พรบ.สง. มาตรา  71', 'พรบ.สง. มาตรา  41']"
0043,การถือหรือมีหนี้่วยลงทุนในกองทุนรวมตราสารแห่งหนี้้ีเพื่อเสริมสภาพคล่อง ของตลาดการเงิน,นำส่งประกาศธนาคารแห่งประเทศไทย เรื่อง การถือหรือมีหน่วยลงทุนในกองทุนรวมตราสารแห่งหนี้เพื่อเสริมสภาพคล่องของตลาดการเงิน,25630071.pdf,2,['สถาบันการเงิน'],"['ประกาศ ธปท.', 'หนังสือเวียน']","['2020-03-26 00:00:00', '1900-01-01 00:00:00']",['ใช้อยู่'],"['ธนาคารพาณิชย์จดทะเบียนในประเทศ', 'ธนาคารพาณิชย์ที่จดทะเบียนในต่างประเทศ']","['พรบ.สง. มาตรา  66', 'พรบ.สง. มาตรา  64', 'พรบ.สง. มาตรา  63', 'พรบ.สง. มาตรา  33']"
0053,หลักเกณฑ์การกำกับ ดูแลโครงการแก้ไขปัญหาหนี้,หลักเกณฑ์การกำกับดูแลโครงการแก้ไขปัญหาหนี้,25630243.pdf,2,['สถาบันการเงิน'],['ประกาศ ธปท.'],['2020-10-01 00:00:00'],['ใช้อยู่'],"['บริษัทบริหารสินทรัพย์', 'บริษัทเครดิตฟองซิเอร์', 'บ.ที่ประกอบธุรกิจสินเชื่อส่วนบุคคลภายใต้การกำกับ', 'ธนาคารพาณิชย์ที่จดทะเบียนในต่างประเทศ', 'บริษัทผู้ประกอบธุรกิจสินเชื่อรายย่อยเพื่อการประกอบอาชีพภายใต้การกำกับ', 'ผู้ประกอบธุรกิจบัตรเครดิต', 'ธนาคารพาณิชย์จดทะเบียนในประเทศ', 'บริษัทเงินทุน']",[]
0054,แนวนโยบายธนาคารแห่งประเทศไทย เรื่อง การสอบทานธุรกรรมด้านสินเชื่อ ของสถาบันการเงิน,แนวนโยบายธนาคารแห่งประเทศไทย เรื่อง การสอบทานธุรกรรมด้านสินเชื่อของสถาบันการเงิน,25630261.pdf,2,['สถาบันการเงิน'],['อื่น ๆ'],['1900-01-01 00:00:00'],['ใช้อยู่'],"['ธนาคารพาณิชย์จดทะเบียนในประเทศ', 'บริษัทเงินทุน', 'บริษัทเครดิตฟองซิเอร์', 'ธนาคารพาณิชย์ที่จดทะเบียนในต่างประเทศ']",[]
0057,แนวทางการใหค้วามช่วยเหลือลูกหนี้้ีที่ไดร้ับผลกระทบจากโรคติดเช้ือไวรัส โคโรนา 2019 (มาตราการแก้หนี้อย่างยั่งยืน),หนังสือเวียน เรื่อง แนวทางการให้ความช่วยเหลือลูกหนี้ที่ได้รับผลกระทบจากโรคติดเชื้อไวรัสโคโรนา 2019 (มาตรการแก้หนี้อย่างยั่งยืน),25640156.pdf,2,['สถาบันการเงิน'],['หนังสือเวียน'],['1900-01-01 00:00:00'],['ใช้อยู่'],"['บริษัทเครดิตฟองซิเอร์', 'ธนาคารพาณิชย์ที่จดทะเบียนในต่างประเทศ', 'บ.ที่ประกอบธุรกิจสินเชื่อส่วนบุคคลภายใต้การกำกับ', 'บริษัทผู้ประกอบธุรกิจสินเชื่อรายย่อยเพื่อการประกอบอาชีพภายใต้การกำกับ', 'ผู้ประกอบธุรกิจบัตรเครดิต', 'ธนาคารพาณิชย์จดทะเบียนในประเทศ', 'บริษัทเงินทุน']",[]
0059,มาตรการกระตุ้นภาค อสังหาริมทรัพย์ในภาวะ การระบาดของโรคติดเชื้อไวรัสโคโรนา 2019,มาตรการกระตุ้นภาคอสังหาริมทรัพย์ในภาวะการระบาดของโรคติดเชื้อไวรัสโคโรนา 2019,25640186.pdf,2,['สถาบันการเงิน'],['หนังสือเวียน'],['1900-01-01 00:00:00'],['ใช้อยู่'],"['บริษัทเครดิตฟองซิเอร์', 'ธนาคารพาณิชย์ที่จดทะเบียนในต่างประเทศ', 'ธนาคารพาณิชย์จดทะเบียนในประเทศ', 'บริษัทเงินทุน', 'สถาบันการเงินเฉพาะกิจ']",[]
0060,แนวทางการใหค้วามช่วยเหลือลูกหนี้้ีที่ไดร้ับผลกระทบจากโรคติดเช้ือไวรัสโค โรนา 2019 (มาตราการแก้หนี้ระยะยาวด้วยการรีไฟแนนส์(refinance) และการ รวมหนี้้ี(debt consolidation)),แนวทางการให้ความช่วยเหลือลูกหนี้ที่ได้รับผลกระทบจากโรคติดเชื้อไวรัสโคโรนา 2019 (มาตรการแก้หนี้ระยะยาวด้วยการรีไฟแนนซ์ (refinance) และการรวมหนี้ (debt consolidation)),25640203.pdf,2,['สถาบันการเงิน'],['หนังสือเวียน'],['1900-01-01 00:00:00'],['ใช้อยู่'],"['บริษัทเครดิตฟองซิเอร์', 'บ.ที่ประกอบธุรกิจสินเชื่อส่วนบุคคลภายใต้การกำกับ', 'ธนาคารพาณิชย์ที่จดทะเบียนในต่างประเทศ', 'บริษัทผู้ประกอบธุรกิจสินเชื่อรายย่อยเพื่อการประกอบอาชีพภายใต้การกำกับ', 'ธนาคารพาณิชย์จดทะเบียนในประเทศ', 'บริษัทเงินทุน', 'สถาบันการเงินเฉพาะกิจ']",[]
0061,กิจการที่ต้องขออนุญาตตามข้อ ๕ แห่งประกาศของคณะปฏิวัติฉบับที่ ๕๘ (เรื่อง สินเชื่อส่วนบุคคลภายใต้การกำกับ),กิจการที่ต้องขออนุญาตตามข้อ ๕ แห่งประกาศของคณะปฏิวัติฉบับที่ ๕๘ (เรื่อง สินเชื่อส่วนบุคคลภายใต้การกำกับ),746244.pdf,2,[],[],[],[],[],[]
0062,กิจการที่ต้องขออนุญาติตามข้อ ๕ แห่งประกาศของคณะปฎิวัติ ฉบับที่ ๕๘ (เรื่องสินเชื่อรายย่อยเพื่อการประกอบอาชีพภายใต้การกำกับ),กิจการที่ต้องขออนุญาติตามข้อ ๕ แห่งประกาศของคณะปฎิวัติ ฉบับที่ ๕๘ (เรื่องสินเชื่อรายย่อยเพื่อการประกอบอาชีพภายใต้การกำกับ),746248.pdf,2,[],[],[],[],[],[]
0063,กิจการที่ต้องขออนุญาติตามข้อ ๕ แห่งประกาศของคณะปฎิวัติ ฉบับที่ ๕๘ (เรื่องธุรกิจระบบหรือเครือข่ายอิเล็กทรอนิกส์สำหรับธุรกรรมสินเชื่อระหว่างบุคคลกับบุคคล),กิจการที่ต้องขออนุญาติตามข้อ ๕ แห่งประกาศของคณะปฎิวัติ ฉบับที่ ๕๘ (เรื่องธุรกิจระบบหรือเครือข่ายอิเล็กทรอนิกส์สำหรับธุรกรรมสินเชื่อระหว่างบุคคลกับบุคคล),863884.pdf,2,[],[],[],[],[],[]
0045,นำส่งประกาศธนาคารแห่งประเทศไทย เรื่องกำหนด หลักเกณฑ์ วิธีการ และเงื่อนไขในการประกอบธุรกิจบัตรเครดิต,การกำหนดหลักเกณฑ์ วิธีการ และเงื่อนไขในการประกอบธุรกิจบัตรเครดิต,25630183.pdf,1,['สถาบันการเงิน'],['ประกาศ ธปท.'],['2020-08-01 00:00:00'],['ใช้อยู่'],"['ผู้ประกอบธุรกิจบัตรเครดิต', 'ธนาคารพาณิชย์จดทะเบียนในประเทศ', 'ธนาคารพาณิชย์ที่จดทะเบียนในต่างประเทศ']","['พรบ.สง. มาตรา  40', 'พรบ.สง. มาตรา  39', 'พรบ.สง. มาตรา  47', 'พรบ.สง. มาตรา  41', 'พรบ.สง. มาตรา  46', 'พรบ.สง. มาตรา  38', 'พรบ.สง. มาตรา  71']"
0046,การกำหนดหลักเกณฑ์ วิธีการ และเงื่อนไขในการประกอบธุรกิจสินเชื่อส่วนบุคคลภายใต้การกำกับ,การกำหนดหลักเกณฑ์ วิธีการ และเงื่อนไขในการประกอบธุรกิจสินเชื่อส่วนบุคคลภายใต้การกำกับ,25630184.pdf,1,['สถาบันการเงิน'],['ประกาศ ธปท.'],['2020-08-01 00:00:00'],['ใช้อยู่'],"['ธนาคารพาณิชย์จดทะเบียนในประเทศ', 'ธนาคารพาณิชย์ที่จดทะเบียนในต่างประเทศ', 'บริษัทเงินทุน', 'บ.ที่ประกอบธุรกิจสินเชื่อส่วนบุคคลภายใต้การกำกับ']","['พรบ.สง. มาตรา  40', 'พรบ.สง. มาตรา  39', 'พรบ.สง. มาตรา  47', 'พรบ.สง. มาตรา  41', 'พรบ.สง. มาตรา  46', 'พรบ.สง. มาตรา  71', 'พรบ.สง. มาตรา  38']"
0047,นำส่งประกาศธนาคารแห่งประเทศไทย เรื่องกำหนด หลักเกณฑ์ วิธีการ และเงื่อนไขในการประกอบธุรกิจสินเชื่อรายย่อยเพื่อการประกอบอาชีพภายใต้การกำกับ,การกำหนดหลักเกณฑ์ วิธีการ และเงื่อนไขในการประกอบธุรกิจสินเชื่อรายย่อยเพื่อการประกอบอาชีพภายใต้การกำกับ,25630185.pdf,1,['สถาบันการเงิน'],['ประกาศ ธปท.'],['2020-08-01 00:00:00'],['ใช้อยู่'],"['ธนาคารพาณิชย์จดทะเบียนในประเทศ', 'บริษัทเงินทุน', 'บริษัทผู้ประกอบธุรกิจสินเชื่อรายย่อยเพื่อการประกอบอาชีพภายใต้การกำกับ', 'ธนาคารพาณิชย์ที่จดทะเบียนในต่างประเทศ']","['พรบ.สง. มาตรา  40', 'พรบ.สง. มาตรา  47', 'พรบ.สง. มาตรา  39', 'พรบ.สง. มาตรา  41', 'พรบ.สง. มาตรา  46', 'พรบ.สง. มาตรา  71', 'พรบ.สง. มาตรา  38']"
0048,นำส่งประกาศธนาคารแห่งประเทศไทย เรื่องกำหนด หลักเกณฑ์ วิธีการ และเงื่อนไขในการประกอบธุรกิจระบบหรือเครือข่ายอิเล็กทรอนิกส์สำหรับธุรกรรมสินเชื่อระหว่างบุคคลกับบุคคล (peer to peer lending platform),การกำหนดหลักเกณฑ์ วิธีการ และเงื่อนไขในการประกอบธุรกิจระบบหรือเครือข่ายอิเล็กทรอนิกส์สำหรับธุรกรรมสินเชื่อระหว่างบุคคลกับบุคคล (peer to peer lending platform),25630186.pdf,1,['สถาบันการเงิน'],['ประกาศ ธปท.'],['2020-08-01 00:00:00'],['ใช้อยู่'],['อื่น ๆ'],[]
0052,หลักเกณฑ์ วิธีการ และเงื่อนไขในการประกอบธุรกิจสินเชื่อส่วนบุคคลดิจิทัล,หลักเกณฑ์ วิธีการ และเงื่อนไขในการประกอบธุรกิจสินเชื่อส่วนบุคคลดิจิทัล,25630236.pdf,1,['สถาบันการเงิน'],['หนังสือเวียน'],['1900-01-01 00:00:00'],['ใช้อยู่'],"['ธนาคารพาณิชย์จดทะเบียนในประเทศ', 'บริษัทเงินทุน', 'บ.ที่ประกอบธุรกิจสินเชื่อส่วนบุคคลภายใต้การกำกับ', 'ธนาคารพาณิชย์ที่จดทะเบียนในต่างประเทศ']",[]
0064,กิจการที่ต้องขออนุญาติตามข้อ ๕ แห่งประกาศของคณะปฎิวัติ ฉบับที่ ๕๘ (เรื่องธุรกิจบัตรเครดิต),กิจการที่ต้องขออนุญาติตามข้อ ๕ แห่งประกาศของคณะปฎิวัติ ฉบับที่ ๕๘ (เรื่องธุรกิจบัตรเครดิต),law9_01.pdf,2,[],[],[],[],[],[]
