0001,หลักประกันเป็นทรัพย์สินที่บริษัทเงินทุนต้องเรียก,หลักประกันเป็นทรัพย์สินที่บริษัทเงินทุนต้องเรียก,25510324.pdf,2,['สถาบันการเงิน'],['ประกาศ ธปท.'],['39664'],['ใช้อยู่'],['บริษัทเงินทุน'],['พรบ.สง. มาตรา  46']
0002,หลักเกณฑ์์การกำกับการทำธุรกรรมกับผู้ถือหุ้นรายใหญ่ หรือกิจการที่มี ผลประโยชน์เกี่ยวข้อง (Related Lending),หลักเกณฑ์การกำกับการทำธุรกรรมกับผู้ถือหุ้นรายใหญ่ หรือกิจการที่มีผลประโยชน์เกี่ยวข้อง (Related Lending),25510326.pdf,2,['สถาบันการเงิน'],['ประกาศ ธปท.'],['39664'],['ใช้อยู่'],"['ธนาคารพาณิชย์จดทะเบียนในประเทศ', 'บริษัทเงินทุน', 'บริษัทเครดิตฟองซิเอร์', 'ธนาคารพาณิชย์ที่จดทะเบียนในต่างประเทศ']",['พรบ.สง. มาตรา  49']
0007,แนวนโยบายการบริหารความเสี่ยงของประเทศคู่สัญญา,แนวนโยบายของธนาคารแห่งประเทศไทย เรื่อง แนวนโยบายการบริหารความเสี่ยงของประเทศคู่สัญญา,25510381.pdf,2,['สถาบันการเงิน'],['อื่น ๆ'],['1'],['ใช้อยู่'],"['ธนาคารพาณิชย์จดทะเบียนในประเทศ', 'ธนาคารพาณิชย์ที่จดทะเบียนในต่างประเทศ']",[]
0011,แนวทางการผ่อนผัน เป็นการชั่วคราวเกี่ยวกบัการดำเนินการตาม พระราชบัญญัติธุรกิจสถาบันการเงิน พ.ศ. 2551,แนวทางการผ่อนผันเป็นการชั่วคราวเกี่ยวกับการดำเนินการตามพระราชบัญญัติธุรกิจสถาบันการเงิน พ.ศ. 2551,25510440.pdf,2,['สถาบันการเงิน'],['หนังสือเวียน'],['1'],['ใช้อยู่'],"['ธนาคารพาณิชย์จดทะเบียนในประเทศ', 'บริษัทเงินทุน', 'บริษัทเครดิตฟองซิเอร์', 'ธนาคารพาณิชย์ที่จดทะเบียนในต่างประเทศ']","['พรบ.สง. มาตรา  49', 'พรบ.สง. มาตรา  50']"
0012,การผ่อนผันหลักเกณฑ์์การกำกับการทำธุรกรรมกับผู้ถือหุ้นรายใหญ่ หรือ กิจการที่มีผลประโยชน์เกี่ยวข้อง (Related Lending),การผ่อนผันหลักเกณฑ์การกำกับการทำธุรกรรมกับผู้ถือหุ้นรายใหญ่ หรือกิจการที่มีผลประโยชน์เกี่ยวข้อง (Related Lending),25510469.pdf,2,['สถาบันการเงิน'],['ประกาศ ธปท.'],['39664'],['ใช้อยู่'],"['ธนาคารพาณิชย์จดทะเบียนในประเทศ', 'บริษัทเงินทุน', 'บริษัทเครดิตฟองซิเอร์', 'ธนาคารพาณิชย์ที่จดทะเบียนในต่างประเทศ']","['พรบ.สง. มาตรา  49', 'พรบ.สง. มาตรา  50']"
0013,แนวนโยบายการให้สินเชื่อแก่ภาคธุรกิจบางประเภท,แนวนโยบายการให้สินเชื่อแก่ภาคธุรกิจบางประเภท,25520039.pdf,2,['สถาบันการเงิน'],"['อื่น ๆ', 'หนังสือเวียน']",['1'],['ใช้อยู่'],"['ธนาคารพาณิชย์จดทะเบียนในประเทศ', 'บริษัทเงินทุน', 'บริษัทเครดิตฟองซิเอร์', 'ธนาคารพาณิชย์ที่จดทะเบียนในต่างประเทศ']",[]
0014,อสังหาริมทรัพย์รอการขาย,นำส่งประกาศธนาคารแห่งประเทศไทย เรื่อง อสังหาริมทรัพย์รอการขาย และเรื่อง หลักเกณฑ์การซื้อหรือมีไว้ซึ่งอสังหาริมทรัพย์เพื่อเป็นสถานที่สำหรับประกอบธุรกิจ หรือสำหรับพนักงานและลูกจ้างของสถาบันการเงิน,255203140.pdf,1,['สถาบันการเงิน'],"['ประกาศ ธปท.', 'หนังสือเวียน']","['1', '39814']",['ใช้อยู่'],"['ธนาคารพาณิชย์จดทะเบียนในประเทศ', 'บริษัทเงินทุน', 'บริษัทเครดิตฟองซิเอร์', 'ธนาคารพาณิชย์ที่จดทะเบียนในต่างประเทศ']",['พรบ.สง. มาตรา  80']
0015,หลักเกณฑ์การซื้อหรือมีไวซ้่ึงอสังหาริมทรัพย์เพื่อเป็นสถานที่สำหรับประกอบ ธุรกิจหรือสำหรับพนักงานและลูกจ้างของสถาบันการเงิน,นำส่งประกาศธนาคารแห่งประเทศไทย เรื่อง อสังหาริมทรัพย์รอการขาย และเรื่อง หลักเกณฑ์การซื้อหรือมีไว้ซึ่งอสังหาริมทรัพย์เพื่อเป็นสถานที่สำหรับประกอบธุรกิจ หรือสำหรับพนักงานและลูกจ้างของสถาบันการเงิน,255203141.pdf,1,['สถาบันการเงิน'],"['ประกาศ ธปท.', 'หนังสือเวียน']","['1', '39814']",['ใช้อยู่'],"['ธนาคารพาณิชย์จดทะเบียนในประเทศ', 'บริษัทเงินทุน', 'บริษัทเครดิตฟองซิเอร์', 'ธนาคารพาณิชย์ที่จดทะเบียนในต่างประเทศ']",['พรบ.สง. มาตรา  80']
0016,หลักเกณฑ์์การดำเนินงานในกิจการร่วมลงทุนเพื่อพัฒนาอสังหาริมทรัพย์รอ การขายของธนาคารพาณิชย์,นำส่งประกาศธนาคารแห่งประเทศไทย เรื่อง หลักเกณฑ์การดำเนินงานในกิจการร่วมลงทุนเพื่อพัฒนาอสังหาริมทรัพย์รอการขายของธนาคารพาณิชย์,25530133.pdf,2,['สถาบันการเงิน'],"['ประกาศ ธปท.', 'หนังสือเวียน']",['40355'],['ใช้อยู่'],"['ธนาคารพาณิชย์จดทะเบียนในประเทศ', 'ธนาคารพาณิชย์ที่จดทะเบียนในต่างประเทศ']","['พรบ.สง. มาตรา  49', 'พรบ.สง. มาตรา  50', 'พรบ.สง. มาตรา  34']"
0017,ซักซ้อมความเข้าใจเกี่ยวกับการกันเงินสดรองสำหรับสินเชื่อที่มีสิทธิใน บำเหนี้็จตกทอดเป็นหลักทรัพย์ประกันการกู้เงิน,ซักซ้อมความเข้าใจเกี่ยวกับการกันเงินสำรองสำหรับสินเชื่อที่มีสิทธิในบำเหน็จตกทอดเป็นหลักทรัพย์ประกันการกู้เงิน,25540095.pdf,2,['สถาบันการเงิน'],['หนังสือเวียน'],['1'],['ใช้อยู่'],"['ธนาคารพาณิชย์จดทะเบียนในประเทศ', 'บริษัทเงินทุน', 'บริษัทเครดิตฟองซิเอร์', 'ธนาคารพาณิชย์ที่จดทะเบียนในต่างประเทศ']",[]
0018,การให้สินเชื่อในลักษณะที่เล็งเห็นว่าจะเรียกคืนไม่ได้,การให้สินเชื่อในลักษณะที่เล็งเห็นว่าจะเรียกคืนไม่ได้,25540167.pdf,2,['สถาบันการเงิน'],"['ประกาศ ธปท.', 'หนังสือเวียน']",['40796'],['ใช้อยู่'],"['ธนาคารพาณิชย์จดทะเบียนในประเทศ', 'บริษัทเงินทุน', 'บริษัทเครดิตฟองซิเอร์', 'ธนาคารพาณิชย์ที่จดทะเบียนในต่างประเทศ']",['พรบ.สง. มาตรา  41']
0019,การซักซ้อมความเข้าใจมาตรการการใหค้วามช่วยเหลือลูกหนี้้ีที่ได้รับ ผลกระทบจากอุทกภัย,การซักซ้อมความเข้าใจมาตรการการให้ความช่วยเหลือลูกหนี้ที่ได้รับผลกระทบจากอุทกภัย,25540206.pdf,2,['สถาบันการเงิน'],['หนังสือเวียน'],['1'],['ใช้อยู่'],"['บริษัทเครดิตฟองซิเอร์', 'ธนาคารพาณิชย์ที่จดทะเบียนในต่างประเทศ', 'บ.ที่ประกอบธุรกิจสินเชื่อส่วนบุคคลภายใต้การกำกับ', 'ผู้ประกอบธุรกิจบัตรเครดิต', 'ธนาคารพาณิชย์จดทะเบียนในประเทศ', 'บริษัทเงินทุน']",[]
0020,หลักเกณฑ์การกำกับ ดูแลสินเชื่อที่ได้รับการคำประกันโดยบรรษัทประกันสินเชื่ออุตสาหกรรมขนาดย่อมแบบ Portfolio Guarantee Scheme,นำส่งประกาศธนาคารแห่งประเทศไทย เรื่อง หลักเกณฑ์การกำกับดูแลสินเชื่อที่ได้รับการค้ำประกันโดยบรรษัทประกันสินเชื่ออุตสาหกรรมขนาดย่อมแบบ Portfolio Guarantee Scheme ,25540268.pdf,2,['สถาบันการเงิน'],"['ประกาศ ธปท.', 'หนังสือเวียน']",['1'],['ใช้อยู่'],"['ธนาคารพาณิชย์จดทะเบียนในประเทศ', 'ธนาคารพาณิชย์ที่จดทะเบียนในต่างประเทศ']","['พรบ.สง. มาตรา  30', 'พรบ.สง. มาตรา  61', 'พรบ.สง. มาตรา  32', 'พรบ.สง. มาตรา  29', 'พรบ.สง. มาตรา  60']"
0022,แนวนโยบายการปรับปรุงโครงสร้างหนี้้ีลูกหนี้้ีที่ประสบอุทกภย,นำส่งแนวนโยบายการปรับปรุงโครงสร้างหนี้ลูกหนี้ที่ประสบอุทกภัย,25550182.pdf,2,['สถาบันการเงิน'],"['อื่น ๆ', 'หนังสือเวียน']",['1'],['ใช้อยู่'],"['บริษัทเครดิตฟองซิเอร์', 'บ.ที่ประกอบธุรกิจสินเชื่อส่วนบุคคลภายใต้การกำกับ', 'ธนาคารพาณิชย์ที่จดทะเบียนในต่างประเทศ', 'ผู้ประกอบธุรกิจบัตรเครดิต', 'ธนาคารพาณิชย์จดทะเบียนในประเทศ', 'บริษัทเงินทุน']",[]
0023,หลักเกณฑ์การกำกับลูกหนี้้ีรายใหญ่ (Single Lending Limit),หลักเกณฑ์การกำกับลูกหนี้รายใหญ่ (Single Lending Limit),25550350.pdf,2,['สถาบันการเงิน'],"['ประกาศ ธปท.', 'หนังสือเวียน']",['41275'],['ใช้อยู่'],"['ธนาคารพาณิชย์จดทะเบียนในประเทศ', 'บริษัทเงินทุน', 'บริษัทเครดิตฟองซิเอร์', 'ธนาคารพาณิชย์ที่จดทะเบียนในต่างประเทศ']","['พรบ.สง. มาตรา  51', 'พรบ.สง. มาตรา  50']"
0024,การอนุญาตให้ธนาคารพาณิชย์ทำธุรกรรมการถ่ายโอนหรือรับโอนความเสี่ยง ด้านเครดิต (Risk participation),การนำส่งประกาศธนาคารแห่งประเทศไทย เรื่อง การอนุญาตให้ธนาคารพาณิชย์ทำธุรกรรมการถ่ายโอนหรือรับโอนความเสี่ยงด้านเครดิต (Risk participation) ,25580004.pdf,2,['สถาบันการเงิน'],"['ประกาศ ธปท.', 'หนังสือเวียน']",['1'],['ใช้อยู่'],"['ธนาคารพาณิชย์จดทะเบียนในประเทศ', 'ธนาคารพาณิชย์ที่จดทะเบียนในต่างประเทศ']","['พรบ.สง. มาตรา  30', 'พรบ.สง. มาตรา  52', 'พรบ.สง. มาตรา  32', 'พรบ.สง. มาตรา  61', 'พรบ.สง. มาตรา  50', 'พรบ.สง. มาตรา  29', 'พรบ.สง. มาตรา  36', 'พรบ.สง. มาตรา  71', 'พรบ.สง. มาตรา  60']"
0025,การแก้ไขหลักเกณฑ์์การนำหลักประกันประเภทเงินฝากบุคคลที่ 3 มาหักออก จากมูลหนี้้ีก่อนการกนั เงินสำรอง ปรับลดความเสี่ยงและคา นวณสินทรัพย์เสี่ยง ด้านเครดิต,การแก้ไขหลักเกณฑ์การนำหลักประกันประเภทเงินฝากบุคคลที่ 3 มาหักออกจากมูลหนี้ก่อนการกันเงินสำรอง ปรับลดความเสี่ยง และคำนวณสินทรัพย์เสี่ยงด้านเครดิต,25580050.pdf,2,['สถาบันการเงิน'],['หนังสือเวียน'],['1'],['ใช้อยู่'],"['ธนาคารพาณิชย์จดทะเบียนในประเทศ', 'บริษัทเงินทุน', 'บริษัทเครดิตฟองซิเอร์', 'ธนาคารพาณิชย์ที่จดทะเบียนในต่างประเทศ']",[]
0026,การให้สินเชื่อ ทำธุรกรรมที่มีลกัษณะคล้ายการให้สินเชื่อ หรือประกนั หนี้้ีแก่ กรรมการ ผู้มีอำนาจในการจัดการของสถาบันการเงิน หรือผู้ที่เกี่ยวข้องกับ บุคคลดังกล่าว,นำส่งประกาศธนาคารแห่งประเทศไทย เรื่อง การให้สินเชื่อ ทำธุรกรรมที่มีลักษณะคล้ายการให้สินเชื่อ หรือประกันหนี้แก่กรรมการ ผู้มีอำนาจในการจัดการของสถาบันการเงิน หรือผู้ที่เกี่ยวข้องกับบุคคลดังกล่าว,25580069.pdf,2,['สถาบันการเงิน'],"['ประกาศ ธปท.', 'หนังสือเวียน']","['1', '42091']",['ใช้อยู่'],"['ธนาคารพาณิชย์จดทะเบียนในประเทศ', 'บริษัทเงินทุน', 'บริษัทเครดิตฟองซิเอร์', 'ธนาคารพาณิชย์ที่จดทะเบียนในต่างประเทศ']",['พรบ.สง. มาตรา  48']
0029,แนวนโยบายธนาคารแห่งประเทศไทย เรื่อง การทำธุรกรรมด้านสินเชื่อ การ ลงทุนในหลักทรัพย์ และการขายสินทรัพย์ของสถาบันการเงิน,นำส่งแนวนโยบายธนาคารแห่งประเทศไทย เรื่อง การทำธุรกรรมด้านสินเชื่อ การลงทุนในหลักทรัพย์,25610030.pdf,2,['สถาบันการเงิน'],['หนังสือเวียน'],['2019-01-01 00:00:00'],['ใช้อยู่'],"['ธนาคารพาณิชย์จดทะเบียนในประเทศ', 'บริษัทเงินทุน', 'บริษัทเครดิตฟองซิเอร์']",[]
0031,หลักเกณฑ์์และวิธีการการลงทุนของสถาบันการเงิน,นำส่งประกาศธนาคารแห่งประเทศไทย เรื่อง หลักเกณฑ์และวิธีการลงทุนของสถาบันการเงิน,25610130.pdf,2,['สถาบันการเงิน'],"['ประกาศ ธปท.', 'หนังสือเวียน']",['2018-05-09 00:00:00'],['ใช้อยู่'],"['ธนาคารพาณิชย์จดทะเบียนในประเทศ', 'บริษัทเงินทุน', 'บริษัทเครดิตฟองซิเอร์', 'ธนาคารพาณิชย์ที่จดทะเบียนในต่างประเทศ']","['พรบ.สง. มาตรา  30', 'พรบ.สง. มาตรา  34', 'พรบ.สง. มาตรา  33']"
0032,หลักเกณฑ์์การจัดชั้นหนี้ี้และการเงินสำรองของสถาบนัการเงิน,ประกาศธนาคารแห่งประเทศไทย ที่ สนส. 23/2561 เรื่อง  หลักเกณฑ์การจัดชั้นและการกันเงินสำรองของสถาบันการเงิน,25610276.pdf,2,['สถาบันการเงิน'],['ประกาศ ธปท.'],['2020-01-01 00:00:00'],['ใช้อยู่'],"['ธนาคารพาณิชย์จดทะเบียนในประเทศ', 'บริษัทเงินทุน', 'บริษัทเครดิตฟองซิเอร์', 'ธนาคารพาณิชย์ที่จดทะเบียนในต่างประเทศ']","['พรบ.สง. มาตรา  61', 'พรบ.สง. มาตรา  60', 'พรบ.สง. มาตรา  47']"
0033,แนวนโยบายการปรับปรุงโครงสร้างหนี้,แนวนโยบาย เรื่อง การปรับปรุงโครงสร้างหนี้,25610277.pdf,2,['สถาบันการเงิน'],['อื่น ๆ'],['1900-01-01 00:00:00'],['ใช้อยู่'],"['ธนาคารพาณิชย์จดทะเบียนในประเทศ', 'บริษัทเงินทุน', 'บริษัทเครดิตฟองซิเอร์', 'ธนาคารพาณิชย์ที่จดทะเบียนในต่างประเทศ']",[]
0035,แนวนโยบายการประเมินราคาหลักประกันและอสังหาริมทรัพย์รอการขายที่ ได้มาจากการรับชำระหนี้ี้การประกนัการให้สินเชื่อ หรือที่ซื้อมาจากการขาย ทอดตลาดของสถาบันการเงิน,นำส่งแนวนโยบายการประเมินราคาหลักประกันและอสังหาริมทรัพย์รอการขายที่ได้มาจากการรับชำระหนี้ การประกันการให้สินเชื่อ หรือที่ซื้อจากการขายทอดตลาดของสถาบันการเงิน,25620100.pdf,2,['สถาบันการเงิน'],['หนังสือเวียน'],['1900-01-01 00:00:00'],['ใช้อยู่'],"['ธนาคารพาณิชย์จดทะเบียนในประเทศ', 'บริษัทเงินทุน', 'บริษัทเครดิตฟองซิเอร์', 'ธนาคารพาณิชย์ที่จดทะเบียนในต่างประเทศ']",[]
