Doc_Page_Sen_ID,Sentence
0063|0003|0028,ภายใต้การกำกับและธุรกิจบริการการชำระเงินภายใต้การกำกับ ตามกฎหมายว่าด้วยระบบการชำระเงิน (๔) ธุรกิจบริหารสินทรัพย์ตามกฎหมายว่าด้วยบริษัทบริหารสินทรัพย์ (๕) ธุรกิจเกี่ยวกับปัจจัยชำระเงินต่างประเทศ ตามกฎหมายว่าด้วยการควบคุมการแลกเปลี่ยนเงิน (5) ธุรกิจประกันชีวิตตามกฎหมายว่าด้วยประกันชีวิต และธุรกิจประกันวินาศภัยตามกฎหมาย ว่าด้วยประกันวินาศภัย (๗) ธุรกิจหลักทรัพย์ ธุรกิจที่ปรึกษาทางการเงิน ธุรกิจที่ปรึกษาการลงทุน และธุรกิจ ให้บริการระบบคราวด์ฟันดึง ตามกฎหมายว่าด้วยหลักทรัพย์และตลาดหลักทรัพย์ (๔) ธุรกิจ
0063|0005|0014,ต้องคำพิพากษาถึงที่สุดว่ากระทำความผิดฐานฟอกเงินหรือเคยต้องคำพิพากษาหรือ คำสั่งของศาลให้ทรัพย์ตกเป็นของแผ่นดิน ตามกฎหมายว่าด้วยการป้องกันและปราบปรามการฟอกเงิน การอนุญาตหรือการขึ้นทะเบียนการประกอบธุรกิจทางการเงินและระบบการชำระเงิน หรือเป็นบุคคลที่ถูกกําหนดให้เป็นผู้ที่มีการกระทำอันเป็นการก่อการร้ายหรือการแพร่ขยายอาวุธ ที่มีอานุภาพทำลายล้างสูง หรือเคยต้องคำพิพากษาถึงที่สุดว่ากระทำความผิดฐานสนับสนุนทางการเงิน แก่การก่อการร้ายหรือการแพร่ขยายอาวุธที่มีอานุภาพทำลายล้างสูง
0063|0005|0015,หรือ คำสั่งของศาลให้ทรัพย์ตกเป็นของแผ่นดิน ตามกฎหมายว่าด้วยการป้องกันและปราบปรามการฟอกเงิน การอนุญาตหรือการขึ้นทะเบียนการประกอบธุรกิจทางการเงินและระบบการชำระเงิน หรือเป็นบุคคลที่ถูกกําหนดให้เป็นผู้ที่มีการกระทำอันเป็นการก่อการร้ายหรือการแพร่ขยายอาวุธ ที่มีอานุภาพทำลายล้างสูง หรือเคยต้องคำพิพากษาถึงที่สุดว่ากระทำความผิดฐานสนับสนุนทางการเงิน แก่การก่อการร้ายหรือการแพร่ขยายอาวุธที่มีอานุภาพทำลายล้างสูง ตามกฎหมายว่าด้วยการป้องกัน และปราบปรามการสนับสนุนทางการเงินแก่การก่อการร้าย
0063|0005|0018,ถูกกําหนดให้เป็นผู้ที่มีการกระทำอันเป็นการก่อการร้ายหรือการแพร่ขยายอาวุธ ที่มีอานุภาพทำลายล้างสูง หรือเคยต้องคำพิพากษาถึงที่สุดว่ากระทำความผิดฐานสนับสนุนทางการเงิน แก่การก่อการร้ายหรือการแพร่ขยายอาวุธที่มีอานุภาพทำลายล้างสูง ตามกฎหมายว่าด้วยการป้องกัน และปราบปรามการสนับสนุนทางการเงินแก่การก่อการร้ายและการแพร่ขยายอาวุธที่มีอานุภาพ ทําลายล้างสูง (๔) เคยเป็นผู้ประกอบธุรกิจทางการเงินและระบบการชำระเงินโดยไม่ได้รับอนุญาตหรือ ขึ้นทะเบียนตามที่กฎหมายกำหนด
0063|0005|0019,การก่อการร้ายหรือการแพร่ขยายอาวุธ ที่มีอานุภาพทำลายล้างสูง หรือเคยต้องคำพิพากษาถึงที่สุดว่ากระทำความผิดฐานสนับสนุนทางการเงิน แก่การก่อการร้ายหรือการแพร่ขยายอาวุธที่มีอานุภาพทำลายล้างสูง ตามกฎหมายว่าด้วยการป้องกัน และปราบปรามการสนับสนุนทางการเงินแก่การก่อการร้ายและการแพร่ขยายอาวุธที่มีอานุภาพ ทําลายล้างสูง (๔) เคยเป็นผู้ประกอบธุรกิจทางการเงินและระบบการชำระเงินโดยไม่ได้รับอนุญาตหรือ ขึ้นทะเบียนตามที่กฎหมายกำหนด และมีพฤติกรรมอันเป็นการกระทำอันไม่เป็นธรรมหรือ เอารัดเอาเปรียบ
0063|0008|0014,ต้องคำพิพากษาถึงที่สุดว่ากระทำความผิดฐานฟอกเงินหรือเคยต้องคำพิพากษา หรือคำสั่งของศาลให้ทรัพย์ตกเป็นของแผ่นดิน ตามกฎหมายว่าด้วยการป้องกันและปราบปรามการฟอกเงิน หรือเป็นบุคคลที่ถูกกําหนดให้เป็นผู้ที่มีการกระทำอันเป็นการก่อการร้ายหรือการแพร่ขยายอาวุธ ที่มีอานุภาพทำลายล้างสูง หรือเคยต้องคำพิพากษาถึงที่สุดว่ากระทำความผิดฐานสนับสนุนทางการเงิน แก่การก่อการร้ายหรือการแพร่ขยายอาวุธที่มีอานุภาพทำลายล้างสูง ตามกฎหมายว่าด้วยการป้องกัน และปราบปรามการสนับสนุนทางการเงินแก่การก่อการร้ายและ
0063|0008|0015,หรือคำสั่งของศาลให้ทรัพย์ตกเป็นของแผ่นดิน ตามกฎหมายว่าด้วยการป้องกันและปราบปรามการฟอกเงิน หรือเป็นบุคคลที่ถูกกําหนดให้เป็นผู้ที่มีการกระทำอันเป็นการก่อการร้ายหรือการแพร่ขยายอาวุธ ที่มีอานุภาพทำลายล้างสูง หรือเคยต้องคำพิพากษาถึงที่สุดว่ากระทำความผิดฐานสนับสนุนทางการเงิน แก่การก่อการร้ายหรือการแพร่ขยายอาวุธที่มีอานุภาพทำลายล้างสูง ตามกฎหมายว่าด้วยการป้องกัน และปราบปรามการสนับสนุนทางการเงินแก่การก่อการร้ายและการแพร่ขยายอาวุธที่มีอานุภาพ ทำลายล้างสูง (จ) เคย
0063|0008|0017,กกําหนดให้เป็นผู้ที่มีการกระทำอันเป็นการก่อการร้ายหรือการแพร่ขยายอาวุธ ที่มีอานุภาพทำลายล้างสูง หรือเคยต้องคำพิพากษาถึงที่สุดว่ากระทำความผิดฐานสนับสนุนทางการเงิน แก่การก่อการร้ายหรือการแพร่ขยายอาวุธที่มีอานุภาพทำลายล้างสูง ตามกฎหมายว่าด้วยการป้องกัน และปราบปรามการสนับสนุนทางการเงินแก่การก่อการร้ายและการแพร่ขยายอาวุธที่มีอานุภาพ ทำลายล้างสูง (จ) เคยเป็นกรรมการ หุ้นส่วนผู้จัดการ หรือผู้มีอำนาจในการจัดการของผู้ประกอบธุรกิจ ทางการเงินและระบบการชำระเงินในขณะที่ถูกเพิกถอนการอนุญาต
0063|0008|0022,การแพร่ขยายอาวุธที่มีอานุภาพ ทำลายล้างสูง (จ) เคยเป็นกรรมการ หุ้นส่วนผู้จัดการ หรือผู้มีอำนาจในการจัดการของผู้ประกอบธุรกิจ ทางการเงินและระบบการชำระเงินในขณะที่ถูกเพิกถอนการอนุญาตประกอบธุรกิจหรือเพิกถอนการจดทะเบียน ประกอบธุรกิจ โดยผู้นั้นมีส่วนเกี่ยวข้องหรือรับผิดชอบในการถูกเพิกถอนการอนุญาตหรือถูกเพิกถอน การจดทะเบียน (2) เคยถูกถอดถอนจากการเป็นกรรมการหรือผู้มีอำนาจในการจัดการของสถาบันการเงิน ตามกฎหมายว่าด้วยธุรกิจสถาบันการเงิน หรือเคยถูกถอดถอนจากการ
0063|0008|0028,การเป็นกรรมการหรือผู้มีอำนาจในการจัดการของสถาบันการเงิน ตามกฎหมายว่าด้วยธุรกิจสถาบันการเงิน หรือเคยถูกถอดถอนจากการเป็นกรรมการหรือผู้มีอำนาจ ในการจัดการของบริษัทหลักทรัพย์ตามกฎหมายว่าด้วยหลักทรัพย์และตลาดหลักทรัพย์ หรือเคยถูกถอดถอน จากการเป็นกรรมการหรือผู้มีอำนาจในการจัดการของบริษัทประกันชีวิตตามกฎหมายว่าด้วยประกันชีวิต หรือบริษัทประกันวินาศภัยตามกฎหมายว่าด้วยประกันวินาศภัย เว้นแต่การถอดถอนนั้นไม่เกี่ยวกับ ความซื่อสัตย์สุจริตหรือทุจริตต่อหน้าที่ (ช) เคยถูกลงโทษไล่ออกหรือปลดออกจากราชการ องค์การ หรือหน่วยงาน
0063|0008|0029,ตามกฎหมายว่าด้วยธุรกิจสถาบันการเงิน หรือเคยถูกถอดถอนจากการเป็นกรรมการหรือผู้มีอำนาจ ในการจัดการของบริษัทหลักทรัพย์ตามกฎหมายว่าด้วยหลักทรัพย์และตลาดหลักทรัพย์ หรือเคยถูกถอดถอน จากการเป็นกรรมการหรือผู้มีอำนาจในการจัดการของบริษัทประกันชีวิตตามกฎหมายว่าด้วยประกันชีวิต หรือบริษัทประกันวินาศภัยตามกฎหมายว่าด้วยประกันวินาศภัย เว้นแต่การถอดถอนนั้นไม่เกี่ยวกับ ความซื่อสัตย์สุจริตหรือทุจริตต่อหน้าที่ (ช) เคยถูกลงโทษไล่ออกหรือปลดออกจากราชการ องค์การ หรือหน่วยงานของรัฐ ฐานทุจริตต่อหน้าที่ (ซ) เคยได้รับโทษจำคุกโดย
0063|0009|0007,กระทําหรือเคยกระทําการอันเป็นการหรือก่อให้เกิดการฉ้อโกง หรือฉ้อโกงประชาชน หรือเป็นการปฏิบัติต่อผู้บริโภคโดยไม่สุจริตหรือไม่เป็นธรรม (2) มีเหตุอันควรสงสัยว่าได้กระทําหรือเคยกระทําการอันเป็นการหรือก่อให้เกิดการเลือก ปฏิบัติหรือแสวงหาประโยชน์ส่ว (ฝ่ายงาน) หรือพวกพ้อง หรือการเข้าไปมีส่วนร่วมในการตัดสินใจใดอันอาจ ก่อให้เกิดผลประโยชน์ทับซ้อน (Conflict of Interest) หรือมีเหตุอันควรสงสัยว่า
0063|0010|0006,เพิกถอนการอนุญาตหรือการขึ้นทะเบียนการประกอบธุรกิจทางการเงินและ (ค) เคยต้องคำพิพากษาถึงที่สุดว่ากระทำความผิดฐานฟอกเงิน หรือเคยต้องคำพิพากษา หรือคำสั่งของศาลให้ทรัพย์ตกเป็นของแผ่นดินตามกฎหมายว่าด้วยการป้องกันและปราบปรามการฟอกเงิน หรือเป็นบุคคลที่ถูกกำหนดให้เป็นผู้ที่มีการกระทำอันเป็นการก่อการร้ายหรือการแพร่ขยายอาวุธ ที่มีอานุภาพทำลายล้างสูง หรือเคยต้องคำพิพากษาถึงที่สุดว่ากระทำความผิดฐานสนับสนุนทางการเงิน แก่การก่อการร้ายหรือการแพร่ขยายอาวุธที่มีอานุภาพทำลายล้างสูง ตามกฎหมายว่าด้วย
0063|0010|0007,เคยต้องคำพิพากษาถึงที่สุดว่ากระทำความผิดฐานฟอกเงิน หรือเคยต้องคำพิพากษา หรือคำสั่งของศาลให้ทรัพย์ตกเป็นของแผ่นดินตามกฎหมายว่าด้วยการป้องกันและปราบปรามการฟอกเงิน หรือเป็นบุคคลที่ถูกกำหนดให้เป็นผู้ที่มีการกระทำอันเป็นการก่อการร้ายหรือการแพร่ขยายอาวุธ ที่มีอานุภาพทำลายล้างสูง หรือเคยต้องคำพิพากษาถึงที่สุดว่ากระทำความผิดฐานสนับสนุนทางการเงิน แก่การก่อการร้ายหรือการแพร่ขยายอาวุธที่มีอานุภาพทำลายล้างสูง ตามกฎหมายว่าด้วยการป้องกัน และปราบปรามการสนับสนุนทางการเงินแก่การก่อการร้ายและการ
0063|0010|0008,คำพิพากษา หรือคำสั่งของศาลให้ทรัพย์ตกเป็นของแผ่นดินตามกฎหมายว่าด้วยการป้องกันและปราบปรามการฟอกเงิน หรือเป็นบุคคลที่ถูกกำหนดให้เป็นผู้ที่มีการกระทำอันเป็นการก่อการร้ายหรือการแพร่ขยายอาวุธ ที่มีอานุภาพทำลายล้างสูง หรือเคยต้องคำพิพากษาถึงที่สุดว่ากระทำความผิดฐานสนับสนุนทางการเงิน แก่การก่อการร้ายหรือการแพร่ขยายอาวุธที่มีอานุภาพทำลายล้างสูง ตามกฎหมายว่าด้วยการป้องกัน และปราบปรามการสนับสนุนทางการเงินแก่การก่อการร้ายและการแพร่ขยายอาวุธที่มีอานุภาพ ทำลายล้างสูง หรือ (ง) เคย
0063|0010|0009,ว่าด้วยการป้องกันและปราบปรามการฟอกเงิน หรือเป็นบุคคลที่ถูกกำหนดให้เป็นผู้ที่มีการกระทำอันเป็นการก่อการร้ายหรือการแพร่ขยายอาวุธ ที่มีอานุภาพทำลายล้างสูง หรือเคยต้องคำพิพากษาถึงที่สุดว่ากระทำความผิดฐานสนับสนุนทางการเงิน แก่การก่อการร้ายหรือการแพร่ขยายอาวุธที่มีอานุภาพทำลายล้างสูง ตามกฎหมายว่าด้วยการป้องกัน และปราบปรามการสนับสนุนทางการเงินแก่การก่อการร้ายและการแพร่ขยายอาวุธที่มีอานุภาพ ทำลายล้างสูง หรือ (ง) เคยเป็นผู้ประกอบธุรกิจทางการเงินและระบบการชำระเงินโดยไม่ได้รับอนุญาต
0063|0011|0021,ถูกต้อง บ ให้รัฐมนตรีโดยคำแนะนำของธนาคารแห่งประเทศไทยพิจารณาและอาจมีคำสั่งว่าจะควรอนุญาต ให้เลิกประกอบธุรกิจได้เมื่อใด ภายใต้เงื่อนไขและวิธีการอย่างใด ทั้งนี้ ให้พิจารณาให้แล้วเสร็จภายใน สามสิบวันทําการ นับแต่วันที่ได้รับความเห็นจากธนาคารแห่งประเทศไทยตามวรรคสอง เว้นแต่ มีเหตุจําเป็นไม่อาจพิจารณาให้แล้วเสร็จภายในระยะเวลาดังกล่าว ให้รัฐมนตรีมีหนังสือแจ้งให้ ผู้ประกอบธุรกิจทราบก่อนครบกำหนดดังกล่าว ในการนี้ ให้ขยายระยะเวลาพิจารณาออกไปได้อีกไม่
0063|0011|0028,ในการนี้ ให้ขยายระยะเวลาพิจารณาออกไปได้อีกไม่เกิน สามสิบวันทําการนับแต่วันครบกําหนดเวลาดังกล่าว ข้อ ๑๘ ให้ธนาคารแห่งประเทศไทยมีอำนาจแต่งตั้งพนักงานธนาคารแห่งประเทศไทย เป็นพนักงานเจ้าหน้าที่ เพื่อปฏิบัติการให้เป็นไปตามประกาศของคณะปฏิวัติ ฉบับที่ ๕๘ ลงวันที่ ๒๖ มกราคม ๒๕๑๕ และประกาศนี้ รวมทั้ง ตรวจ (ฝ่ายงาน) การดำเนินงานของกิจการตามที่กำหนดไว้ ในประกาศนี้ และดำเนินคดีสำหรับความผิดตามประกาศของคณะปฏิวัติ ฉบับที่ ๕๘ ลงวันที่ ๒๖ มกราคม ๒๕๑๕ ข้อ ๑๙ เมื่อพนักงานเจ้าหน้าที่
