Doc_Page_Sen_ID,Sentence
0069|0033|0008,ของสถาบันการเงินอื่นหรือกลุ่มธุรกิจทางการเงินอื่น มูลค่าของตราสารหนี้หรือตราสารทุนอ้างอิงที่นับเข้าเป็นเงินกองทุนของสถาบันการเงินอื่นหรือกลุ่มธุรกิจทางการเงินอื่น กรณีสถาบัน การเงินหรือบริษัทใ (ฝ่ายงาน) ุ่มธุรกิจทางการเงินเป็นผู้ซื้ออนุพันธ์ทางการเงินด้านตราสารหนี้หรือตราสารทุน (Bond or Equity derivative) และกรณีสถาบันการเงินหรือบริษัทใ (ฝ่ายงาน) ุ่มธุรกิจทางการเงินเป็นผู้ชายข้อตกลงรับประกันความเสี่ยงด้านเครดิต (Credit derivative) 5.3
0069|0033|0014,หรือบริษัทใ (ฝ่ายงาน) ุ่มธุรกิจทางการเงินเป็นผู้ชายข้อตกลงรับประกันความเสี่ยงด้านเครดิต (Credit derivative) 5.3 มูลค่าข้อตกลงรับประกันความเสี่ยง กรณีสถาบันการเงินหรือบริษัทใ (ฝ่ายงาน) ุ่มธุรกิจทางการเงินเป็นผู้ขายอนุพันธ์ด้านเครดิตประเภท First-todefault credit derivative ซึ่งผลิตภัณฑ์ทางการเงินที่รองรับความเสี่ยงของกลุ่มสินทรัพย์อ้างอิงเป็นตราสารระยะยาวที่มี Rating เกรด 5 5.4 มูลค่าข้อตกลงรับประกันความเสี่ยง กรณีสถาบันการเงินหรือบริษัทใ (ฝ่ายงาน) ุ่มธุรกิจทางการเงินเป็นผู้ขายอนุพันธ์ด้าน
0069|0033|0015,ข้อตกลงรับประกันความเสี่ยงด้านเครดิต (Credit derivative) 5.3 มูลค่าข้อตกลงรับประกันความเสี่ยง กรณีสถาบันการเงินหรือบริษัทใ (ฝ่ายงาน) ุ่มธุรกิจทางการเงินเป็นผู้ขายอนุพันธ์ด้านเครดิตประเภท First-todefault credit derivative ซึ่งผลิตภัณฑ์ทางการเงินที่รองรับความเสี่ยงของกลุ่มสินทรัพย์อ้างอิงเป็นตราสารระยะยาวที่มี Rating เกรด 5 5.4 มูลค่าข้อตกลงรับประกันความเสี่ยง กรณีสถาบันการเงินหรือบริษัทใ (ฝ่ายงาน) ุ่มธุรกิจทางการเงินเป็นผู้ขายอนุพันธ์ด้านเครดิตประเภท First-todefault credit derivative ซึ่งผลิตภัณฑ์ทางการเงินที่รองรับ
0069|0033|0019,กลุ่มสินทรัพย์อ้างอิงเป็นตราสารระยะยาวที่มี Rating เกรด 5 5.4 มูลค่าข้อตกลงรับประกันความเสี่ยง กรณีสถาบันการเงินหรือบริษัทใ (ฝ่ายงาน) ุ่มธุรกิจทางการเงินเป็นผู้ขายอนุพันธ์ด้านเครดิตประเภท First-todefault credit derivative ซึ่งผลิตภัณฑ์ทางการเงินที่รองรับความเสี่ยงของกลุ่มสินทรัพย์อ้างอิงเป็นตราสารระยะสั้นที่มี Rating เกรด 4 5.5 มูลค่าเงินให้สินเชื่อด้อยสิทธิ์หรือเงินลงทุนในตราสารด้อยสิทธิ์ กรณีที่สถาบันการเงินหรือบริษัทใ (ฝ่ายงาน) ุ่มธุรกิจทางการเงินเป็นผู้รับประกันส่วน
0069|0033|0022,เครดิตประเภท First-todefault credit derivative ซึ่งผลิตภัณฑ์ทางการเงินที่รองรับความเสี่ยงของกลุ่มสินทรัพย์อ้างอิงเป็นตราสารระยะสั้นที่มี Rating เกรด 4 5.5 มูลค่าเงินให้สินเชื่อด้อยสิทธิ์หรือเงินลงทุนในตราสารด้อยสิทธิ์ กรณีที่สถาบันการเงินหรือบริษัทใ (ฝ่ายงาน) ุ่มธุรกิจทางการเงินเป็นผู้รับประกันส่วน สูญเสียในลำดับแรกให้แก่ผู้ลงทุนในตราสาร Traditional และ Synthetic Securitisation (First loss facility provider) หรือลงทุนในตราสาร ที่ Securitisation ไม่มี Rating 5.6 มูล
0069|0033|0028,และ Synthetic Securitisation (First loss facility provider) หรือลงทุนในตราสาร ที่ Securitisation ไม่มี Rating 5.6 มูลค่าเงินให้สินเชื่อหรือเงินลงทุนในตราสารหนี้ในส่วนที่ต่ำกว่าความเสียหายขั้นต่ำซึ่งผู้ขายข้อตกลงรับประกันความเสี่ยงจะไม่ชดเชยความ เสียหาย 5.7 ฐานะที่เกี่ยวข้องกับการชำระราคาและการส่งมอบที่ยังไม่เสร็จสิ้น (Unsettled transactions) กรณีธุรกรรม Non-delivery versus payment (Non-DvP) 5.7.1 มูลค่าของขาแรกที่ได้ส่งมอบไป
0069|0033|0031,ที่ต่ำกว่าความเสียหายขั้นต่ำซึ่งผู้ขายข้อตกลงรับประกันความเสี่ยงจะไม่ชดเชยความ เสียหาย 5.7 ฐานะที่เกี่ยวข้องกับการชำระราคาและการส่งมอบที่ยังไม่เสร็จสิ้น (Unsettled transactions) กรณีธุรกรรม Non-delivery versus payment (Non-DvP) 5.7.1 มูลค่าของขาแรกที่ได้ส่งมอบไปแล้ว 5.7.2 ส่วนต่างของมูลค่าธุรกรรมกับมูลค่าตลาดปัจจุบัน (Positive current exposure) 5.8 Expected loss ของฐานะที่เกี่ยวข้องกับตราสารทุนที่คำนวณโดยวิธี
0069|0033|0032,ไม่ชดเชยความ เสียหาย 5.7 ฐานะที่เกี่ยวข้องกับการชำระราคาและการส่งมอบที่ยังไม่เสร็จสิ้น (Unsettled transactions) กรณีธุรกรรม Non-delivery versus payment (Non-DvP) 5.7.1 มูลค่าของขาแรกที่ได้ส่งมอบไปแล้ว 5.7.2 ส่วนต่างของมูลค่าธุรกรรมกับมูลค่าตลาดปัจจุบัน (Positive current exposure) 5.8 Expected loss ของฐานะที่เกี่ยวข้องกับตราสารทุนที่คำนวณโดยวิธี PD/LGD 5.9 เงินสำรองส่วนขาด (EL >
0069|0034|0009,ตารางที่ 3 : องค์ประกอบของเงินกองทุน ให้กลุ่มธุรกิจทางการเงินคำนวณเงินกองทุนตามหลักเกณฑ์ที่กำหนดในเรื่อง องค์ประกอบเงินกองทุนสำหรับกลุ่มธุรกิจทางการเงิน ตามประกาศธนาคารแห่งประเทศไทยว่าด้วย หลักเกณฑ์การกำกับแบบรวมกลุ่ม รวมทั้งใช้ความหมายของรายการต่าง ๆ ตามที่กำหนดใน Classification ชื่อ Capital Fund Item ที่ใช้ในการรายงานชุดข้อมูล Capital Fund โดยอนุโลม และความหมายที่กําหนดเพิ่มเติมดังนี้ 2 1. รายการที่ 1.8 และรายการที่ 2.9 ส่วนได้เสียที่
0069|0034|0023,ที่ 1 เงินกองทุนชั้นที่ 2 และหักรายการที่ต้องนำมาหักออกจากเงินกองทุน ตามหลักเกณฑ์เช่นเดียวกับส่วนของธนาคารพาณิชย์หรือบริษัทแม่ ส่วนได้เสียที่ไม่มีอำนาจควบคุมที่เป็นรายการส่วนเกิน (ต่ำกว่า) ทุน (สุทธิ) จากการตีราคาเงินลงทุนในตราสารทุนประเภทเผื่อขาย ให้นำส่วนเกิน (ต่ำกว่า) ทุน (สุทธิ) ๆ ของ ทุกบริษัทมาหักกลบกันก่อนที่จะนำมาคำนวณเงินกองทุน หากหักกลบแล้วมี
0069|0034|0028,เผื่อขาย ให้นำส่วนเกิน (ต่ำกว่า) ทุน (สุทธิ) ๆ ของ ทุกบริษัทมาหักกลบกันก่อนที่จะนำมาคำนวณเงินกองทุน หากหักกลบแล้วมียอดเป็นส่วนต่ำกว่าทุน (สุทธิ) ๆ ให้นำไปหักออกจากเงินกองทุนทั้งสิ้นโดยแสดงไว้ในรายการที่ 3.2.1.2 (ในกรณีหักกลบแล้ว มียอดเป็นส่วนเกินทุน (สุทธิ) ๆ จะรวมอยู่ในรายการที่ 2.9) 2. รายการ
0069|0034|0029,สุทธิ) ๆ ของ ทุกบริษัทมาหักกลบกันก่อนที่จะนำมาคำนวณเงินกองทุน หากหักกลบแล้วมียอดเป็นส่วนต่ำกว่าทุน (สุทธิ) ๆ ให้นำไปหักออกจากเงินกองทุนทั้งสิ้นโดยแสดงไว้ในรายการที่ 3.2.1.2 (ในกรณีหักกลบแล้ว มียอดเป็นส่วนเกินทุน (สุทธิ) ๆ จะรวมอยู่ในรายการที่ 2.9) 2. รายการที่ 1.10.5 และรายการที่ 2.11.1 ส่วนที่ให้หัก
0069|0035|0003,ในรายการที่ 5.1 2.2 มูลค่าของตราสารหนี้หรือตราสารทุนอ้างอิงที่นับเข้าเป็นเงินกองทุน ของสถาบันการเงินอื่นหรือกลุ่มธุรกิจทางการเงินอื่น กรณีสถาบันการเงินหรือบริษัทใ (ฝ่ายงาน) ุ่มธุรกิจ ทางการเงินเป็นผู้ซื้ออนุพันธ์ทางการเงินด้านตราสารหนี้หรือตราสารทุน (Bond or Equity derivative) และกรณีสถาบันการเงินหรือบริษัทใ (ฝ่ายงาน) ุ่มธุรกิจทางการเงินเป็นผู้ขายข้อตกลง รับประกันความเสี่ยงด้านเครดิต (Credit derivative) หมายถึง กรณีบริษัทใ (ฝ่ายงาน)
0069|0035|0006,บริษัทใ (ฝ่ายงาน) ุ่มธุรกิจ ทางการเงินเป็นผู้ซื้ออนุพันธ์ทางการเงินด้านตราสารหนี้หรือตราสารทุน (Bond or Equity derivative) และกรณีสถาบันการเงินหรือบริษัทใ (ฝ่ายงาน) ุ่มธุรกิจทางการเงินเป็นผู้ขายข้อตกลง รับประกันความเสี่ยงด้านเครดิต (Credit derivative) หมายถึง กรณีบริษัทใ (ฝ่ายงาน) ุ่มธุรกิจทาง การเงินที่จัดทำงบการเงินรวมของกลุ่มธุรกิจทางการเงินเป็นผู้ซื้ออนุพันธ์ทางการเงินด้านตราสารหนี้ หรือตราสารทุน (Bond or Equity derivative) และ
0069|0035|0009,ุ่มธุรกิจทางการเงินเป็นผู้ขายข้อตกลง รับประกันความเสี่ยงด้านเครดิต (Credit derivative) หมายถึง กรณีบริษัทใ (ฝ่ายงาน) ุ่มธุรกิจทาง การเงินที่จัดทำงบการเงินรวมของกลุ่มธุรกิจทางการเงินเป็นผู้ซื้ออนุพันธ์ทางการเงินด้านตราสารหนี้ หรือตราสารทุน (Bond or Equity derivative) และกรณีบริษัทใ (ฝ่ายงาน) ุ่มธุรกิจทางการเงินที่จัดทำ งบการเงินรวมของกลุ่มธุรกิจทางการเงินเป็นผู้ขายข้อตกลงรับประกันความเสี่ยงด้านเครดิต (Credit derivative) ที่อ้างอิงตราสาร
0069|0035|0014,กรณีบริษัทใ (ฝ่ายงาน) ุ่มธุรกิจทางการเงินที่จัดทำ งบการเงินรวมของกลุ่มธุรกิจทางการเงินเป็นผู้ขายข้อตกลงรับประกันความเสี่ยงด้านเครดิต (Credit derivative) ที่อ้างอิงตราสารหนี้หรือตราสารทุนที่นับเข้าเป็นเงินกองทุนของสถาบันการเงินอื่นหรือ กลุ่มธุรกิจทางการเงินอื่น ที่ต้องนำจำนวนเงินตามสัญญาของธุรกรรมมาหักออกจากเงินกองทุน ตามที่ รายการที่ 5.2 กําหนดในหลักเกณฑ์การกำกับแบบรวมกลุ่ม โดยให้กรอกจำนวนเงินตามสัญญาของ
0069|0035|0023,และการส่งมอบที่ยังไม่เสร็จสิ้น (Unsettled transactions) กรณีธุรกรรม Non-delivery versus payment (Non-DvP) หมายถึง ฐานะที่เกิดขึ้นจากการที่บริษัทใ (ฝ่ายงาน) ุ่มธุรกิจทางการเงินทำธุรกรรมที่มีการชำระราคาและ การส่งมอบในลักษณะ Non-delivery versus payment (Non-DvP) โดยได้ชำระราคาหรือส่งมอบ หลักทรัพย์ เครื่องมือด้านอัตราแลกเปลี่ยน หรือสินค้าโภคภัณฑ์ แล้วเป็นขาแรก (1 SD) และการรับ มอบขาที่สองยังไม่
0069|0035|0050,ธุรกิจทางการเงินอื่น ที่ลงทุนโดยบริษัทใ (ฝ่ายงาน) ุ่มธุรกิจทางการเงินที่จัดทำ งบการเงินรวมของกลุ่มธุรกิจทางการเงิน ที่ต้องนำมาหักออกจากเงินกองทุนตามที่กำหนดใน หลักเกณฑ์การกำกับแบบรวมกลุ่ม โดยให้กรอกมูลค่าเงินลงทุนดังกล่าวในรายการที่ 5.10 2.5 เงินลงทุนในบริษัทจำกัดที่กำหนดให้หักออกจากเงินกองทุน หมายถึง เงินลงทุนในบริษัทลูกใ (ฝ่ายงาน) ุ่มธุรกิจทางการเงินที่ประกอบธุรกิจประกันภัยและธุรกิจประกันชีวิตทั้ง ทางตรงและทางอ้อม เงินลงทุนในบริษัทลูก
0069|0036|0000,และธุรกิจประกันชีวิต) ที่บริษัทแม่ถือหุ้นทางตรงและทางอ้อมรวมกันไม่ถึงร้อยละ 50 ของหุ้นที่ จำหน่ายได้แล้วทั้งหมดของบริษัทนั้น เงินลงทุนในบริษัทนอกกลุ่มธุรกิจทางการเงินที่บริษัทแม่ของ กลุ่มธุรกิจทางการเงินถือหุ้นทางตรงและทางอ้อมรวมกันเป็นร้อยละ 10 ของหุ้นที่จำหน่ายได้แล้ว ทั้งหมดของบริษัทนั้น และเงินลงทุนที่บริษัทที่ประกอบธุรกิจเงินร่วมลงทุนไปลงทุนในบริษัทต่าง ๆ เกินระยะเวลาที่กำหนด ที่ต้องนำมาหักออกจากเงิน
0069|0036|0003,ธุรกิจทางการเงินที่บริษัทแม่ของ กลุ่มธุรกิจทางการเงินถือหุ้นทางตรงและทางอ้อมรวมกันเป็นร้อยละ 10 ของหุ้นที่จำหน่ายได้แล้ว ทั้งหมดของบริษัทนั้น และเงินลงทุนที่บริษัทที่ประกอบธุรกิจเงินร่วมลงทุนไปลงทุนในบริษัทต่าง ๆ เกินระยะเวลาที่กำหนด ที่ต้องนำมาหักออกจากเงินกองทุนตามที่กำหนดในหลักเกณฑ์การกำกับ แบบรวมกลุ่ม โดยให้กรอกมูลค่าเงินลงทุนดังกล่าวในรายการที่ 5.11 ทั้งนี้ ให้หักเงินลงทุนดังกล่าวออกจากเงินกองทุนด้วยมูลค่าเงินลงทุนตาม
0069|0036|0007,เกินระยะเวลาที่กำหนด ที่ต้องนำมาหักออกจากเงินกองทุนตามที่กำหนดในหลักเกณฑ์การกำกับ แบบรวมกลุ่ม โดยให้กรอกมูลค่าเงินลงทุนดังกล่าวในรายการที่ 5.11 ทั้งนี้ ให้หักเงินลงทุนดังกล่าวออกจากเงินกองทุนด้วยมูลค่าเงินลงทุนตาม วิธีที่มาตรฐานการบัญชีกำหนดในการจัดทำงบการเงินรวม โดยพิจารณาจำนวนหุ้นที่ธนาคารพาณิชย์ หรือบริษัทแม่ถือทางตรงและทางอ้อมรวมกัน ทั้งนี้ เงินลงทุนในบริษัทใดที่ถูกหักออกจากเงินกองทุน แล้ว ไม่ต้องนำเงินลงทุนที่บริษัท
0069|0036|0018,คำนวณตามวิธี SA หมายถึง General Provision (เงินสำรองสำหรับสินทรัพย์จัดชั้ (ฝ่ายงาน) ติทั้งหมดแต่ไม่รวมถึงเงินสำรอง สําหรับสินทรัพย์จัดชั้ (ฝ่ายงาน) ติส่วนที่นับเป็น Specific Provision แล้ว) ที่ได้กันไว้ตามประกาศธนาคาร แห่งประเทศไทยว่าด้วยหลักเกณฑ์การจัดชั้นและการกันเงินสํารองของสถาบันการเงิน หรือตาม หลักเกณฑ์ที่กำหนดโดยหน่วยงานที่กำกับดูแลบริษัทนั้น หรือตามมาตรฐานการบัญชี โดยบริษัทนอก กลุ่ม Solo Consolidation ต้องได้รับอนุญาต
0069|0037|0000,ตารางที่ 3 : องค์ประกอบของเงินกองทุน 1. เงินกองทุนชั้นที่ 1 1.1 ทุนชำระแล้ว 1.1.1 ตามบัญชี 1.1.2 หัก หุ้นทุนซื้อคืน (ราคาตามมูลค่า) 1.2 ใบสำคัญแสดงสิทธิที่จะซื้อหุ้น 1.3 ส่วนเกิน (ต่ำกว่า) มูลค่าหุ้น (สุทธิ) 1.3.1 ส่วนเกิน (ต่ำกว่า) มูลค่าของหุ้นที่ออกใหม่และใบสำคัญแสดงสิทธิที่จะซื้อหุ้น 1.3.2 ส่วนเกินทุน หุ้นทุนซื้อคืน 1.4 ทุนสำรองตามกฎหมาย 1.5 เงินสำรอง
