Doc_Page_Sen_ID,Sentence
0089|0006|0005,Conservation buffer) ที่เกินกว่าร้อยละ 2.5 ของสินทรัพย์เสี่ยงทั้งสิ้น และอัตราส่วน เงินกองทุนส่วนเพิ่มเพื่อรองรับความเสี่ยงเชิงระบบที่อาจเกิดขึ้นในช่วงเศรษฐกิจขาลง (Countercyclicat buffer) ที่ร้อยละ 0-2.5 ของสินทรัพย์เสี่ยงทั้งสิ้น (2) การกํากับดูแลโดยทางการ ซึ่งกำหนดบทบาทของบริษัทเครดิตฟองซิเอร์ให้มี การบริหารความเสี่ยงที่ดี มีกระบวนการประเมินความเพียงพอของเงินกองทุนโดยคำนึงถึงความเสี่ยง ทุกด้าน รวมทั้งมีการทด
0089|0008|0022,มูลค่าหลักประกัน (Loan to value ratio: LTV ratio) การกันเงินสำรองส่วนเพิ่ม เป็นต้น มาประกอบการพิจารณาด้วย และธนาคารแห่งประเทศไทยจะแจ้งให้บริษัทเครดิตฟองซิเอร์ทราบล่วงหน้าถึงรายละเอียดและปัจจัย ในการพิจารณากําหนดการดำรงเงินกองทุนส่วนเพิ่มเพื่อรองรับความเสี่ยงเชิงระบบที่อาจเกิดขึ้นในช่วง เศรษฐกิจขาลง และระดับเงินกองทุนส่วนเพิ่มที่ต้องดำรงในช่วงเวลาดังกล่าวก่อนการบังคับใช้จริง ซึ่งรวมถึงแ (ฝ่ายงาน) างการพิจารณายกเลิกการบังคับใช้การดำรงเงินกองทุนส่วนเพิ่ม
0089|0009|0014,บริษัทเครดิตฟองซิเอร์จะต้องมีเงินกองทุน สูงกว่าอัตราขั้นต่ำตามกฎหมาย และเพียงพอที่จะรองรับความเสียหายที่อาจเกิดขึ้นจากการดำเนินธุรกิจ ภายใต้ภาวะปกติและภาวะวิกฤต (Stress test) โดยนำหลักเกณฑ์ที่กำหนดไว้ในประกาศธนาคารแห่ง ประเทศไทยว่าด้วยหลักเกณฑ์การกำกับดูแลเงินกองทุนโดยทางการ (Pillar 2) มาใช้บังคับโดย อนุโลม ทั้งนี้ บริษัทเครดิตฟองซิเอร์จะต้องจัดทำรายงานการประเมินความเพียงพอของเงินกองทุน (ICAAP Report) และผลการทด
0089|0009|0028,มีกระบวนการ ICAAP ไม่เหมาะสม หรือมีเงินกองทุนต่ำกว่าที่พึงมีเพื่อรองรับความเสี่ยงทั้งหมด ธนาคารแห่งประเทศไทยจะดำเนิน มาตรการให้บริษัทเครดิตฟองซิเอร์นั้น ปรับปรุงระบบการบริหารความเสี่ยงให้สอดคล้องกับระดับ ความเสี่ยงที่มีอยู่ภายในเวลาที่เหมาะสม และในกรณีที่บริษัทเครดิตฟองซิเอร์ไม่สามารถปฏิบัติตามที่ ธนาคารแห่งประเทศไทยกำหนดได้ ธนาคารแห่งประเทศไทยอาจใช้อำนาจตามมาตรา 30 วรรคสอง แห่งพระราชบัญญัติธุรกิจสถาบันการเงิน พ.ศ. 2551 สั่งการให้บริษัทเครดิตฟองซิเอร์นั้น ดำเนินการ ใด ๆ ที่เกี่ยวข้องตามที่เห็ (ฝ่ายงาน) ควรเพื่อลดระดับความเสี่ยง
0089|0023|0001,Scope of application) กก ตัวชี้วัดความเสี่ยงที่สำคัญ (Key prudential metrics) เงินกองทุน (Capital) ข หัวข้อ 1 โครงสร้างเงินกองทุน (Capital structure) หัวข้อ 2 ความเพียงพอของเงินกองทุน (Capital adequacy) ข้อมูลที่เกี่ยวข้องกับการประเมินความเสี่ยงด้านต่าง ๆ ของบริษัท เครดิตฟองซิเอร์ (Risk exposure and assessment) 1. ข้อมูลเชิงคุณภาพโดยทั่วไป สำหรับทุกประเภทความเสี่ยง 1. ข้อมูลในแต่ละประเภทความเสี่ยง ซึ่งแบ่งเป็นข้อมูล
0089|0028|0015,5.2) นอกงบแสดงฐานะการเงินของบริษัทเครดิตฟองซิเอร์ ให้แสดงมูลค่ายอด คงค้าง ณ สิ้นงวดที่รายงาน มูลค่ายอดคงค้าง ณ สิ้นงวดก่อนหน้า และ เปรียบเทียบกับมูลค่ายอดคงค้างเฉลี่ย ในระหว่างงวดระยะเวลาที่มีการ รายงาน โดยแยกแสดงรายการตามประเภทฐานะ (Exposure) ที่สำคัญ 4 ดงน: 1.1 สินทรัพย์ใ (ฝ่ายงาน) แสดงฐานะการเงิน 1.1.1 เงินให้สินเชื่อและดอกเบี้ยค้างรับสุทธิ (รวมเงินให้สินเชื่อ
0089|0030|0019,ทุนในบัญชีเพื่อการธนาคาร มูลค่าฐานะที่เกี่ยวข้องกับตราสารทุนตามที่ปรากฏใ (ฝ่ายงาน) แสดงฐานะการเงิน ตามมาตรฐานการบัญชีและหลักเกณฑ์ของธนาคารแห่งประเทศไทยที่ เกี่ยวข้อง โดยแยกตามประเภทและลักษณะการลงทุน ดังนี้ 12 1.1 มูลค่าฐานะที่เกี่ยวข้องกับตราสารทุนที่จดทะเบียนในตลาดหลักทรัพย์ (ทั้งในประเทศและต่างประเทศ) ให้เปิดเผยโดยใช้มูลค่ายุติธรรม 1.2 มูลค่าฐานะที่เกี่ยวข้องกับตราสารทุนอื่น ๆ ทั้งในประเทศและ ต่างประเทศ) ให้เปิดเผยโดยใช้
0089|0031|0003,ตามรายละเอียดดังต่อไปนี้ 1. รายละเอียดข้อมูลเชิงคุณภาพโดยทั่วไปตามหัวข้อ 1. สำหรับความเสี่ยงด้าน อัตราดอกเบี้ยในบัญชีเพื่อการธนาคาร 2. คำอธิบายลักษณะของความเสี่ยงด้านอัตราดอกเบี้ยในบัญชีเพื่อการธนาคาร ของบริษัทเครดิตฟองซิเอร์ 3. สมมติฐานสำคัญประกอบการประเมินความเสี่ยง เช่น สมมติฐานเกี่ยวกับ การชำระหนี้คืนก่อนกำหนดของลูกหนี้ ลักษณะพฤติกรรมของบัญชีเงินฝาก ที่ไม่มีกําหนดระยะเวลา (Non-maturity deposits) ข้อมูลเชิงปริมาณ ความถี่ของการวัดความเสี่ยงด้านอัตราดอกเบี้ยในบัญชีเพื่อการธนาคาร ผลจาก
0089|0034|0000,คำอธิบายข้อมูลเชิงปริมาณ (Accompanying narrative) รวมถึงคำอธิบายเกี่ยวกับ ให้บริษัทเครดิตฟองซิเอร์เปิดเผยคำอธิบายข้อมูลเชิงปริมาณหากมีการเปลี่ยนแปลงอย่างมีนัยสำคัญของตัวชี้วัดความเสี่ยง ปัจจัยหลัก (key drivers) ที่ก่อให้เกิดการเปลี่ยนแปลงดังกล่าว เช่น การเปลี่ยนแปลงของเกณฑ์การกำกับดูแลหรือโมเดลธุรกิจ (Business model) ทั้งนี้ บริษัทเครดิตฟองซิเอร์ที่เลือกทยอยรับรู้ผลกระทบต่อเงินกองทุนจากการกันเงินสำรองตาม TFRS 9 จะต้องอธิบายเพิ่มเติมวิธีการที่ใช้ในการทยอย รับรู้ผลกระทบนั้น
0089|0037|0009,รับ สุทธิ รายการนอกงบแสดงฐานะ การเงิน รายการนอกงบแสดงฐานะ การเงิน 1 รวมรายได้ดอกเบี้ยที่ยังไม่ถึงกำหนดชำระ สุทธิจากรายได้รอตัดบัญชี ผลกำไรหรือขาดทุนจากการเปลี่ยนแปลงเงื่อนไขใหม่ และค่าเผื่อผลขาดทุนด้านเครดิตที่คาดว่าจะเกิดขึ้น และรวมเงินให้สินเชื่อและดอกเบี้ยค้างรับสุทธิของ รายการระหว่างธนาคารและตลาดเงินด้วย 2/ หมายรวมถึงเงินลงทุนในลูกหนี้ด้วย ซึ่งไม่รวมดอกเบี้ยค้างรับ และ
0089|0038|0000,ตารางที่ 8 มูลค่ายอดคงค้างของสินทรัพย์ใ (ฝ่ายงาน) แสดงฐานะการเงินและรายการนอกงบแสดงฐานะการเงิน จำแ (ฝ่ายงาน) ามอายุสัญญาที่เหลือ 1. สินทรัพย์ใ (ฝ่ายงาน) แสดงฐานะการเงิน (1.1 + 1.2 + 1.3 + 1.4) 1/ 1.1 เงินให้สินเชื่อและดอกเบี้ยค้างรับสุทธิ 1.2 เงินลงทุนในตราสารหนี้สุทธิ 1.3 เงินฝากและดอกเบี้ยค้างรับสุทธิ 2. รายการนอกงบแสดงฐานะการเงิน อายุไม่
0089|0038|0007,2. รายการนอกงบแสดงฐานะการเงิน อายุไม่เกิน 1 ปี อายุเกิน 1 ปี อายุไม่เกิน 1 ปี 2 หมายรวมถึงเงินลงทุนในลูกหนี้ด้วย ซึ่งไม่รวมดอกเบี้ยค้างรับ และสุทธิจากค่าเพื่อการปรับมูลค่าของหลักทรัพย์ และค่าเผื่อผลขาดทุนด้านเครดิตที่คาดว่าจะเกิดขึ้น 3 รวมรายได้ดอกเบี้ยที่ยังไม่ถึงกำหนดชำระ และสุทธิจากค่าเผื่อผลขาดทุนด้านเครดิตที่คาดว่าจะเกิดขึ้น
0089|0041|0016,การด้อยค่า ด้านเครดิต ที่มีการด้อยค่าด้านเครดิต เมื่อเริ่มแรกที่ซื้อหรือได้มา * รวมรายได้ดอกเบี้ยที่ยังไม่ถึงกำหนดชำระ สุทธิจากรายได้รอตัดบัญชี และผลกำไรหรือขาดทุนจากการเปลี่ยนแปลงเงื่อนไขใหม่ และรวมเงินให้สินเชื่อและดอกเบี้ยค้างรับของรายการระหว่างธนาคารและตลาดเงินด้วย สำหรับปีบัญชีแรกที่ประกาศนี้มีผลบังคับใช้ ให้บริษัทเครดิตฟองซิเอร์เปิดเผยข้อมูลเฉพาะของปีปัจจุบัน โดยไม่ต้องเปิดเผยข้อมูลเปรียบเทียบของปีก่อน ที่มีการ
0089|0043|0017,ดอกเบี้ยที่ยังไม่ถึงกำหนดชำระ สุทธิจากรายได้รอตัดบัญชี ผลกำไรหรือขาดทุนจากการเปลี่ยนแปลงเงื่อนไขใหม่ และค่าเผื่อผลขาดทุนด้านเครดิตที่คาดว่าจะเกิดขึ้น และรวมเงินให้สินเชื่อและดอกเบี้ยค้างรับสุทธิของ รายการระหว่างธนาคารและตลาดเงินด้วย 2/ หมายรวมถึงเงินลงทุนในลูกหนี้ด้วย ซึ่งไม่รวมดอกเบี้ยค้างรับ และสุทธิหลังค่าเพื่อการปรับมูลค่าของหลักทรัพย์ และค่าเพื่อผลขาดทุนด้านเครดิตที่
0089|0043|0018,ตัดบัญชี ผลกำไรหรือขาดทุนจากการเปลี่ยนแปลงเงื่อนไขใหม่ และค่าเผื่อผลขาดทุนด้านเครดิตที่คาดว่าจะเกิดขึ้น และรวมเงินให้สินเชื่อและดอกเบี้ยค้างรับสุทธิของ รายการระหว่างธนาคารและตลาดเงินด้วย 2/ หมายรวมถึงเงินลงทุนในลูกหนี้ด้วย ซึ่งไม่รวมดอกเบี้ยค้างรับ และสุทธิหลังค่าเพื่อการปรับมูลค่าของหลักทรัพย์ และค่าเพื่อผลขาดทุนด้านเครดิตที่คาดว่าจะเกิดขึ้น 3 รวมรายได้ดอกเบี้ยที่ยัง
0089|0043|0020,เกิดขึ้น และรวมเงินให้สินเชื่อและดอกเบี้ยค้างรับสุทธิของ รายการระหว่างธนาคารและตลาดเงินด้วย 2/ หมายรวมถึงเงินลงทุนในลูกหนี้ด้วย ซึ่งไม่รวมดอกเบี้ยค้างรับ และสุทธิหลังค่าเพื่อการปรับมูลค่าของหลักทรัพย์ และค่าเพื่อผลขาดทุนด้านเครดิตที่คาดว่าจะเกิดขึ้น 3 รวมรายได้ดอกเบี้ยที่ยังไม่ถึงกำหนดชำระ และสุทธิจากค่าเผื่อผลขาดทุนด้านเครดิตที่คาดว่าจะเกิดขึ้น สินทรัพย์ใ (ฝ่ายงาน)
0089|0044|0000,หัวข้อ 3 ข้อมูลฐานะที่เกี่ยวข้องกับตราสารทุนในบัญชีเพื่อการธนาคาร ตารางที่ 15 มูลค่าฐานะที่เกี่ยวข้องกับตราสารทุนในบัญชีเพื่อการธนาคาร มูลค่าฐานะที่เกี่ยวข้องกับตราสารทุน 1. มูลค่าฐานะที่เกี่ยวข้องกับตราสารทุน 1.1 มูลค่าตราสารทุนที่จดทะเบียนในตลาดหลักทรัพย์ (ทั้งในประเทศและต่างประเทศ) 1.2 มูลค่าตราสารทุนอื่น (ทั้งในประเทศและต่างประเทศ) 2. กำไร (ขาดทุน) จากการขายตราสารทุนระหว่าง
0089|0044|0001,บัญชีเพื่อการธนาคาร ตารางที่ 15 มูลค่าฐานะที่เกี่ยวข้องกับตราสารทุนในบัญชีเพื่อการธนาคาร มูลค่าฐานะที่เกี่ยวข้องกับตราสารทุน 1. มูลค่าฐานะที่เกี่ยวข้องกับตราสารทุน 1.1 มูลค่าตราสารทุนที่จดทะเบียนในตลาดหลักทรัพย์ (ทั้งในประเทศและต่างประเทศ) 1.2 มูลค่าตราสารทุนอื่น (ทั้งในประเทศและต่างประเทศ) 2. กำไร (ขาดทุน) จากการขายตราสารทุนระหว่างงวดการรายงาน 3. ส่วนเกินทุน (ต่ำกว่าทุน
0089|0044|0004,กับตราสารทุน 1.1 มูลค่าตราสารทุนที่จดทะเบียนในตลาดหลักทรัพย์ (ทั้งในประเทศและต่างประเทศ) 1.2 มูลค่าตราสารทุนอื่น (ทั้งในประเทศและต่างประเทศ) 2. กำไร (ขาดทุน) จากการขายตราสารทุนระหว่างงวดการรายงาน 3. ส่วนเกินทุน (ต่ำกว่าทุน) สุทธิจากการตีราคาเงินลงทุนในตราสารทุนที่กำหนดให้วัดมูลค่าด้วยมูลค่า ยุติธรรมผ่านกำไรขาดทุนเบ็ดเสร็จอื่น 4. มูลค่าเงินกองทุนขั้นต่ำสำหรับฐานะที่
0090|0003|0005,โดยอ้างอิงหลักเกณฑ์ Basel III: a global regulatory framework for more resilient banks and banking systems (Revised version: June 2011) va Basel Committee on Banking Supervision (BCBS) เพื่อให้ธนาคารพาณิชย์มีเงินกองทุนที่มีคุณภาพดีและเพียงพอรองรับความเสียหายที่ อาจเกิดขึ้นได้ทั้งในภาวะปกติและภาวะวิกฤต และเพื่อรักษาเสถียรภาพระบบสถาบันการเงิน โดยรวม นั้น ในครั้งนี้ ธนาคารแห่งประเทศไทยเห็นควรปรับปรุงหลักเกณฑ์การคำนวณสินทรัพย์ เสี่ยงด้านเครดิตสําหรับธนาคารพาณิชย์โดย
0090|0019|0001,ที่กําหนด ในเอกสารแนบ 4 อย่างไรก็ดี ธนาคารแห่งประเทศไทยคาดหวังว่าธนาคารพาณิชย์เต็มรูปแบบ ควรใช้วิธีกำหนดน้ำหนักความเสี่ยงตาม Rating ที่ลูกหนี้ได้รับจาก ECAIS อย่างไรก็ตาม ในกรณีที่สินทรัพย์และรายการนอกงบดุลตามข้อ 1.1 1.6 ที่ได้รับน้ำหนัก ความเสี่ยงร้อยละ 150 และมีการกันเงินสํารองไว้แล้ว ให้ธนาคารพาณิชย์ใช้น้ำหนักความเสี่ยงที่ลดลง ได้ ตามที่ธนาคารแห่งประเทศไทยกําหนด ดังนี้ (1) หากสินทรัพย์และรายการนอกงบดุลดังกล่าวมี Specific provision
0090|0019|0014,หากสินทรัพย์และรายการนอกงบดุลดังกล่าวมี Specific provision ตั้งแต่ ร้อยละ 50 ขึ้นไป ของยอดหนี้คงค้างทั้งสิ้น กำหนดนํ้าหนักความเสี่ยงร้อยละ 50 นอกจากนี้ ในกรณีที่สินทรัพย์และรายการนอกงบดุลตามข้อ 1.1 1.6 ที่ได้รับน้ำหนัก ความเสี่ยงร้อยละ 100 หากมี Specific provision ตั้งแต่ร้อยละ 50 ขึ้นไปของยอดหนี้คงค้างทั้งสิ้น กําหนด าหนักความเสี่ยงร้อยละ 50 7. ลูกหนี้รายย่อย 7.1 ลูกหนี้รายย่อยที่มีคุณสมบัติดังต่อไปนี้ครบทุกข้อ กำหนดน้ำหนักความเสี่ยง
