Doc_Page_Sen_ID,Sentence
0002|0008|0002,"ตามกฎหมายว่าด้วยสัญญาซื้อขาย 
 ล่วงหน้า ธุรกิจประกันชีวิตตามกฎหมายว่าด้วยประกันชีวิต หรือธุรกิจอื่นตามที่ธนาคารแห่ง 
 ประเทศไทยประกาศกำหนด 
 (2) “การให้สินเชื่อ” หมายความว่า การให้กู้ยืมเงิน หรือซื้อ ซื้อลด รับช่วงซื้อลด 
 ตั๋วเงินเป็นเจ้าหนี้เนื่องจากได้จ่ายหรือสั่งให้จ่ายเงินเพื่อประโยชน์ของผู้เคยค้า หรือเป็นเจ้าหนี้ 
 เนื่องจากได้จ่ายเงินตามภาระผูกพันตามเล็ตเตอร์ออฟเครดิตหรือภาระผูกพันอื่น 
 ("
0002|0008|0005,"หมายความว่า การให้กู้ยืมเงิน หรือซื้อ ซื้อลด รับช่วงซื้อลด 
 ตั๋วเงินเป็นเจ้าหนี้เนื่องจากได้จ่ายหรือสั่งให้จ่ายเงินเพื่อประโยชน์ของผู้เคยค้า หรือเป็นเจ้าหนี้ 
 เนื่องจากได้จ่ายเงินตามภาระผูกพันตามเล็ตเตอร์ออฟเครดิตหรือภาระผูกพันอื่น 
 (3) “ธุรกรรมที่มีลักษณะคล้ายการให้สินเชื่อ” หมายความว่า ธุรกรรมแฟ็กเตอริง 
 ธุรกรรมการให้เช่าซื้อ ธุรกรรมการให้เช่าแบบลีสซิ่ง"
0002|0009|0009,"อย่างอื่น 
 (9.2) บุคคลซึ่งสถาบันการเงินหรือบริษัททำสัญญาให้มีอำนาจในการบริหารงาน 
 ทั้งหมดหรือบางส่วน หรือ 
 (9.3) บุคคลที่ตามพฤติการณ์มีอำนาจควบคุมหรือครอบงำผู้จัดการหรือกรรมการ 
 หรือการจัดการของสถาบันการเงินหรือบริษัท ให้ปฏิบัติตามคำสั่งของตนในการกำหนดนโยบาย 
 หรือการดำเนินงานของสถาบันการเงินหรือบริษัท 
 (10) “ผู้ที่เกี่ยวข้อง” หมายความว่า บุคคลที่มีความสัมพันธ์กับอีกบุคคลหนึ่ง"
0002|0010|0000,"(11) “ผู้ถือหุ้นรายใหญ่” หมายความว่า บุคคลที่ถือหุ้นหรือมีไว้ซึ่งหุ้นของสถาบัน 
 การเงินเกินร้อยละห้าของหุ้นที่จำหน่ายได้แล้วทั้งหมด และให้นับรวมหุ้นที่ถือโดยผู้ที่เกี่ยวข้องด้วย 
 (12) “กิจการที่มีผลประโยชน์เกี่ยวข้อง” หมายความว่า บริษัทที่สถาบันการเงิน 
 กรรมการของสถาบันการเงิน ผู้มีอำนาจในการจัดการของสถาบันการเงิน หรือผู้ที่เกี่ยวข้องกับ 
 บุคคลเหล่านี้ ถือหุ้นรวมกันเกินร้อยละสิบ"
0002|0013|0023,"ว่า ได้ตกลงผูกพันค้ำประกัน 
 หนี้ของลูกหนี้ ซึ่งมีเงื่อนไขอย่างน้อยในสัญญาว่า ในกรณีที่ สง, ผ่อน 
 เวลาให้แก่ลูกหนี้ในการชำระหนี้ บุคคลที่ 3 ที่เป็นผู้ประกันได้ตกลงกับ 
 การผ่อนเวลาดังกล่าว และยินยอมไม่ถือเอาการผ่อนเวลาดังกล่าวเป็นเหตุ 
 ปลดเปลื้องความรับผิดชอบของผู้ค้ำประกัน ตามหนังสือเวียน ธปท. ที่ 
 ธปท. (ฝ่ายงาน) .(21)ว. 25 (วันที่)ลง (วันที่)เรื่อง การนำ 
 หลักประกันประเภทเงินฝากบุคคลที่ 3"
0012|0007|0000,"คําจํากัดความ 
 (1) “การให้สินเชื่อ” หมายความว่า การให้กู้ยืมเงิน หรือซื้อ ซื้อลด รับช่วงซื้อลด 
 ตั๋วเงินเป็นเจ้าหนี้เนื่องจากได้จ่ายหรือสั่งให้จ่ายเงินเพื่อประโยชน์ของผู้เคยค้า หรือเป็นเจ้าหนี้ 
 เนื่องจากได้จ่ายเงินตามภาระผูกพันตามเล็ตเตอร์ออฟเครดิตหรือภาระผูกพันอื่น 
 (2) “ธุรกรรมที่มีลักษณะคล้ายการให้สินเชื่อ” หมายความว่า ธุรกรรมแฟกเตอริง"
0012|0007|0001,"สินเชื่อ” หมายความว่า การให้กู้ยืมเงิน หรือซื้อ ซื้อลด รับช่วงซื้อลด 
 ตั๋วเงินเป็นเจ้าหนี้เนื่องจากได้จ่ายหรือสั่งให้จ่ายเงินเพื่อประโยชน์ของผู้เคยค้า หรือเป็นเจ้าหนี้ 
 เนื่องจากได้จ่ายเงินตามภาระผูกพันตามเล็ตเตอร์ออฟเครดิตหรือภาระผูกพันอื่น 
 (2) “ธุรกรรมที่มีลักษณะคล้ายการให้สินเชื่อ” หมายความว่า ธุรกรรมแฟกเตอริง 
 ธุรกรรมการให้เช่าซื้อ ธุรกรรมการให้เช่าแบบลี"
0012|0007|0023,"กรรมการทั้งหมดในบริษัทหนึ่ง หรือ 
 (5.4) มีอำนาจควบคุมกิจการในลักษณะอื่นใดตามหลักเกณฑ์ที่ธนาคารแห่ง 
 ประเทศไทยประกาศทําหนด 
 การมีหุ้นในบริษัทหนึ่งตั้งแต่ร้อยละยี่สิบขึ้นไปของหุ้นที่จำหน่ายได้แล้วทั้งหมด 
 ไม่ว่าโดยทางตรงหรือทางอ้อม ให้สันนิษฐานไว้ก่อนว่ามีอำนาจควบคุมกิจการ เว้นแต่จะพิสูจน์ได้ 
 ว่ามิได้มีอำนาจควบคุมกิจการ 
 (6) “บริษัทลูก” หมายความว่า 
"
0012|0008|0004,"อื่น 
 (8.2) บุคคลซึ่งสถาบันการเงินหรือบริษัททำสัญญาให้มีอำนาจในการบริหารงาน 
 ทั้งหมดหรือบางส่วน หรือ 
 (8.3) บุคคลที่ตามพฤติการณ์มีอำนาจควบคุมหรือครอบงำผู้จัดการหรือกรรมการ 
 หรือการจัดการของสถาบันการเงินหรือบริษัท ให้ปฏิบัติตามคำสั่งของตนในการกำหนดนโยบาย 
 หรือการดำเนินงานของสถาบันการเงินหรือบริษัท 
 (9) “ผู้ที่เกี่ยวข้อง” หมายความว่า บุคคลที่มีความสัมพันธ์กับอีกบุคคลหนึ่งใน"
0012|0008|0023,") หรือ (9.4) หรือ (9.5) 
 (9.7) เป็นบริษัทร่วมของบริษัทตาม (9.3) หรือ (9.4) หรือ (9.5) 
 (9.8) เป็นตัวการ ตัวแทน หรือ 
 (9.9) บุคคลอื่นที่มีลักษณะตามที่ธนาคารแห่งประเทศไทยประกาศกำหนด 
 ในกรณีที่บุคคลใดถือหุ้นในบริษัทใดตั้งแต่ร้อยละยี่สิบขึ้นไปของหุ้นที่จำหน่ายได้ 
 แล้วทั้งหมดไม่ว่าโดยทางตรงหรือทางอ้อม ให้สันนิษฐานไว้"
0012|0008|0028,"กำหนด 
 ในกรณีที่บุคคลใดถือหุ้นในบริษัทใดตั้งแต่ร้อยละยี่สิบขึ้นไปของหุ้นที่จำหน่ายได้ 
 แล้วทั้งหมดไม่ว่าโดยทางตรงหรือทางอ้อม ให้สันนิษฐานไว้ก่อนว่าบริษัทนั้นเป็นผู้ที่เกี่ยวข้องกับ 
 บุคคลดังกล่าว เว้นแต่จะพิสูจน์ได้ว่ามิได้เป็นผู้ที่เกี่ยวข้อง 
 (10) “ผู้ถือหุ้นรายใหญ่” หมายความว่า บุคคลที่ถือหุ้นหรือมีไว้ซึ่งหุ้นของสถาบัน 
 การเงินเกินร้อยละห้าของหุ้นที่จำหน่าย"
0012|0008|0034,"หมายความว่า บุคคลที่ถือหุ้นหรือมีไว้ซึ่งหุ้นของสถาบัน 
 การเงินเกินร้อยละห้าของหุ้นที่จำหน่ายได้แล้วทั้งหมด และให้นับรวมหุ้นที่ถือโดยผู้ที่เกี่ยวข้องด้วย 
 (11) “กิจการที่มีผลประโยชน์เกี่ยวข้อง” หมายความว่า บริษัทที่สถาบันการเงิน 
 กรรมการของสถาบันการเงิน ผู้มีอำนาจในการจัดการของสถาบันการเงิน หรือผู้ที่เกี่ยวข้องกับ 
 บุคคลเหล่านี้ ถือหุ้นรวมกันเป็นร้อยละสิบของจำนวนหุ้นที่จำหน่ายได้แล้ว"
0023|0012|0003,"ตามกฎหมายว่าด้วยสัญญาซื้อขายล่วงหน้า 
 ธุรกิจประกันชีวิตตามกฎหมายว่าด้วยประกันชีวิต หรือธุรกิจอื่นตามที่ธนาคารแห่งประเทศไทย 
 ประกาศกำหนด 
 (2) “การให้สินเชื่อ” หมายความว่า การให้กู้ยืมเงิน หรือซื้อ ซื้อลด รับช่วงซื้อลดตัวเงินเป็น 
 เจ้าหนี้เนื่องจากได้จ่ายหรือสั่งให้จ่ายเงินเพื่อประโยชน์ของผู้เคยค้า หรือเป็นเจ้าหนี้เนื่องจากได้ 
 จ่ายเงินตามภาระผูกพันตามเล็ตเตอร์ออฟเครดิตหรือภาระผูกพันอื่น 
 (3) “"
0023|0012|0005,"2) “การให้สินเชื่อ” หมายความว่า การให้กู้ยืมเงิน หรือซื้อ ซื้อลด รับช่วงซื้อลดตัวเงินเป็น 
 เจ้าหนี้เนื่องจากได้จ่ายหรือสั่งให้จ่ายเงินเพื่อประโยชน์ของผู้เคยค้า หรือเป็นเจ้าหนี้เนื่องจากได้ 
 จ่ายเงินตามภาระผูกพันตามเล็ตเตอร์ออฟเครดิตหรือภาระผูกพันอื่น 
 (3) “ธุรกรรมที่มีลักษณะคล้ายการให้สินเชื่อ” หมายความว่า ธุรกรรมแฟกเตอริง ธุรกรรม 
 การให้เช่าซื้อ"
0023|0012|0021,"โดยทางตรงหรือทางอ้อม ในลักษณะดังต่อไปนี้ 
 (61) มีหุ้นในบริษัทหนึ่งเกินกว่าร้อยละห้าสิบของหุ้นที่จำหน่ายได้แล้วทั้งหมด 
 (62) มีอำนาจควบคุมคะแนนเสียงส่วนใหญ่ในที่ประชุมผู้ถือหุ้นของบริษัทหนึ่ง 
 (6.3) มีอำนาจควบคุมการแต่งตั้งหรือถอดถอนผู้มีอำนาจในการจัดการหรือ 
 กรรมการตั้งแต่กึ่งหนึ่งของกรรมการทั้งหมดในบริษัทหนึ่ง หรือ 
 (6.4) มีอำนาจควบคุมกิจการในลักษณะอื่นใดตามหลักเกณฑ์"
0023|0012|0022,") มีหุ้นในบริษัทหนึ่งเกินกว่าร้อยละห้าสิบของหุ้นที่จำหน่ายได้แล้วทั้งหมด 
 (62) มีอำนาจควบคุมคะแนนเสียงส่วนใหญ่ในที่ประชุมผู้ถือหุ้นของบริษัทหนึ่ง 
 (6.3) มีอำนาจควบคุมการแต่งตั้งหรือถอดถอนผู้มีอำนาจในการจัดการหรือ 
 กรรมการตั้งแต่กึ่งหนึ่งของกรรมการทั้งหมดในบริษัทหนึ่ง หรือ 
 (6.4) มีอำนาจควบคุมกิจการในลักษณะอื่นใดตามหลักเกณฑ์ที่ธนาคารแห่ง 
 ประเทศไทยประกาศกำหนด 
 การ"
0023|0012|0028,") มีอำนาจควบคุมกิจการในลักษณะอื่นใดตามหลักเกณฑ์ที่ธนาคารแห่ง 
 ประเทศไทยประกาศกำหนด 
 การมีหุ้นในบริษัทหนึ่งตั้งแต่ร้อยละยี่สิบขึ้นไปของหุ้นที่จำหน่ายได้แล้วทั้งหมดไม่ว่า 
 โดยทางตรงหรือทางอ้อม ให้สันนิษฐานไว้ก่อนว่ามีอำนาจควบคุมกิจการ เว้นแต่จะพิสูจน์ได้ว่ามิได้มี 
 อำนาจควบคุมกิจการ 
 (7) “บริษัทลูก” หมายความว่า 
 (7.1) บริษัท บริษัทอื่นเป็นบริษัทแม่"
0023|0013|0016,") หรือข้อ (9.4) หรือข้อ (9.5) 
 (9.8) เป็นตัวการ ตัวแทน หรือ 
 (9.9) บุคคลอื่นที่มีลักษณะตามที่ธนาคารแห่งประเทศไทยประกาศกำหนด 
 ในกรณีที่บุคคลใดถือหุ้นในบริษัทใดตั้งแต่ร้อยละยี่สิบขึ้นไปของหุ้นที่จำหน่ายได้แล้ว 
 ทั้งหมดไม่ว่าโดยทางตรงหรือทางอ้อม ให้สันนิษฐานไว้ก่อนว่าบริษัทนั้นเป็นผู้ที่เกี่ยวข้องกับบุคคล 
 ดังกล่าว เว้นแต่จะพิสูจน์ได้ว่ามิได้เป็น"
0023|0028|0031,"สัญญาโดยชอบด้วยกฎหมายว่า ได้ตกลงผูกพันค้ำประกันหนี้ของลูกหนี้ ซึ่งมี 
 เงื่อนไขอย่างน้อยในสัญญาว่า ในกรณีที่ สง. ผ่อนเวลาให้แก่ลูกหนี้ในการ 
 ชำระหนี้ บุคคลที่ 3 ที่เป็นผู้ค้ำประกันได้ตกลงกับการผ่อนเวลาดังกล่าว และ 
 ยินยอมไม่ถือเอาการผ่อนเวลาดังกล่าวเป็นเหตุปลดเปลื้องความรับผิดชอบ 
 ของผู้ค้ำประกัน ตามหนังสือเวียน ธปท. ที่ ธปท. (ฝ่ายงาน) . (21) ว. 25 (วันที่)
 ลง (วันที่)เรื่อง การนำหลักประกันประเภท"
0026|0003|0018,"
 “ผู้ที่เกี่ยวข้อง” หมายความว่า บุคคลที่มีความสัมพันธ์กับอีกบุคคลหนึ่งในลักษณะ 
 (1) เป็นคู่สมรส 
 (2) เป็นบุตรหรือบุตรบุญธรรมที่ยังไม่บรรลุนิติภาวะ 
 (3) เป็นบริษัทที่บุคคลนั้นหรือบุคคลตาม (1) หรือ (2) มีอำนาจในการจัดการ 
 (4) เป็นบริษัทที่บุคคลนั้นหรือบุคคลตาม (1) หรือ (2) มีอำนาจควบคุมคะแนนเสียง"
0032|0003|0008,"วิชาชีพบัญชี ในพระบรมราชูปถัมภ์ได้ประกาศใช้มาตรฐานการรายงาน 
 ทางการเงิน ฉบับที่ 9 เรื่อง เครื่องมือทางการเงิน ซึ่งจะมีผลใช้บังคับกับการจัดทำงบการเงินที่เริ่มต้น 
 ในหรือหลัง (วันที่)เป็นต้นไป เพื่อให้มาตรฐานการรายงานทางการเงินของไทยมี 
 ความสอดคล้องกับมาตรฐานการรายงานทางการเงินระหว่างประเทศ ซึ่งจะส่งผลกระทบต่อวิธีการจัดชั้น 
 การกันเงินสำรอง และการตัดสินทรัพย์ออกจากบัญชีของสถาบันการเงิน ดังนั้น ธนาคารแห่งประเทศไทย 
 จึงเห็นควรปรับปรุงหลักเกณฑ์การจัดชั้น"
0033|0004|0015,"
 เรื่อง การปรับปรุงโครงสร้างหนี้ 
 เนื่องจากสภาวิชาชีพบัญชี ในพระบรมราชูปถัมภ์ได้ประกาศใช้มาตรฐานการรายงาน 
 ทางการเงิน ฉบับที่ 9 เรื่อง เครื่องมือทางการเงิน ซึ่งจะมีผลใช้บังคับกับการจัดทำงบการเงินที่เริ่มต้น 
 ในหรือหลัง (วันที่)เป็นต้นไป เพื่อให้มาตรฐานการรายงานทางการเงินของไทยมี 
 ความสอดคล้องกับมาตรฐานการรายงานทางการเงินระหว่างประเทศ ซึ่งจะส่งผลกระทบต่อวิธีการจัดชั้น 
 การกันเงินสำรอง และการตัดออกจากบัญชี ดังนั้น ธนาคารแห่งประเทศไทยจึงเห็นควรปรับปรุง"
0045|0001|0015,"เพื่อส่งเสริมให้มีหลักธรรมาภิบาลที่ดี 
 ในการดำเนินธุรกิจ (Good Corporate Governance) รวมถึงเพื่อปรับลดอัตรารวมสูงสุดของดอกเบี้ย เบี้ยปรับ 
 ค่าปรับ ค่าบริการ และค่าธรรมเนียมใด ๆ ที่สถาบันการเงินและผู้ประกอบธุรกิจบัตรเครดิตที่มิใช่สถาบันการเงิน 
 อาจเรียกเก็บจากลูกหนี้เหลือร้อยละ 16 ต่อปี ตามที่ พ.ร.บ. ธุรกิจสถาบันการเงิน พ.ศ. 2551 และที่แก้ไขเพิ่มเติม 
 และประกาศกระทรวงการคลังว่าด้วยกิจการที่ต้องขออนุญาตตามข้อ 5 แห่งประกาศของคณะปฏิวัติ"
